Rank;Sourceid;Title;Type;Issn;SJR;SJR Best Quartile;H index;Total Docs. (2007);Total Docs. (3years);Total Refs.;Total Cites (3years);Citable Docs. (3years);Cites / Doc. (2years);Ref. / Doc.;Country;Region;Publisher;Coverage;Categories
1;19700202606;"Andean Geology";journal;"07187092, 07187106";0,879;Q1;36;15;50;923;74;50;1,00;61,53;Chile;Latin America;"Servicio Nacional de Geologia y Mineria";"2009-2020";"Geology (Q1); Paleontology (Q1); Stratigraphy (Q1); Geochemistry and Petrology (Q2)"
2;13260;"Biological Research";journal;"07176287, 07169760";0,697;Q1;55;52;186;1829;279;177;1,10;35,17;United Kingdom;Western Europe;"BioMed Central Ltd.";"1992-2020";"Agricultural and Biological Sciences (miscellaneous) (Q1); Medicine (miscellaneous) (Q1); Biochemistry, Genetics and Molecular Biology (miscellaneous) (Q2)"
3;27797;"Revista Mexicana de Astronomia y Astrofisica";journal;"01851101";0,654;Q2;34;30;80;1010;62;80;0,79;33,67;Mexico;Latin America;"Universidad Nacional Autonoma de Mexico";"1996-2020";"Astronomy and Astrophysics (Q2); Space and Planetary Science (Q2)"
4;15205;"Memorias do Instituto Oswaldo Cruz";journal;"16788060, 00740276";0,607;Q2;89;181;600;5045;856;594;1,41;27,87;Brazil;Latin America;"Fundacao Oswaldo Cruz";"1945, 1948, 1950-1971, 1974-1976, 1980-2020";"Medicine (miscellaneous) (Q2); Microbiology (medical) (Q2)"
5;19375;"Water S.A.";journal;"18167950, 03784738";0,578;Q2;59;101;267;3037;259;262;0,98;30,07;South Africa;Africa;"South African Water Research Commission";"1976-2020";"Applied Microbiology and Biotechnology (Q2); Management, Monitoring, Policy and Law (Q2); Waste Management and Disposal (Q2); Water Science and Technology (Q2)"
6;22596;"Revista de Saude Publica";journal;"00348910, 15188787";0,550;Q2;77;184;513;3094;554;445;0,92;16,82;Brazil;Latin America;"University of Sao Paolo";"1967-2020";"Medicine (miscellaneous) (Q2); Public Health, Environmental and Occupational Health (Q2)"
7;24663;"Revista de la Asociacion Geologica Argentina";journal;"00044822";0,539;Q2;39;64;200;2362;78;199;0,34;36,91;Argentina;Latin America;"Asociacion Geologica Argentina";"1992-1994, 1996-2020";"Geology (Q2)"
8;20135;"Cadernos de Saude Publica";journal;"0102311X, 16784464";0,507;Q2;77;387;754;10510;742;693;0,84;27,16;Brazil;Latin America;"Fundacao Oswaldo Cruz";"1998-2020";"Medicine (miscellaneous) (Q2); Public Health, Environmental and Occupational Health (Q2)"
9;145505;"Revista Brasileira de Ciencia do Solo";journal;"01000683";0,496;Q2;51;162;318;4912;222;318;0,55;30,32;Brazil;Latin America;"Revista Brasileira de Ciencia do Solo";"2004-2020";"Agronomy and Crop Science (Q2); Soil Science (Q3)"
10;4400151728;"Revista Mexicana de Ciencias Geologicas";journal;"10268774";0,486;Q2;35;40;97;1780;82;95;0,85;44,50;Mexico;Latin America;"Universidad Nacional Autonoma de Mexico";"1996-2020";"Geology (Q2)"
11;28675;"Brazilian Journal of Medical and Biological Research";journal;"0100879X, 1414431X";0,473;Q1;88;201;655;6101;979;653;1,44;30,35;Brazil;Latin America;"Associacao Brasileira de Divulgacao Cientifica";"1973-2020";"Pharmacology, Toxicology and Pharmaceutics (miscellaneous) (Q1); Medicine (miscellaneous) (Q2); Biochemistry (Q3); Biophysics (Q3); Immunology (Q3); Neuroscience (miscellaneous) (Q3); Physiology (Q3); Cell Biology (Q4)"
12;19262;"Revista Brasileira de Psiquiatria";journal;"1809452X, 15164446";0,469;Q2;53;122;304;2760;309;190;1,01;22,62;Brazil;Latin America;"Associacao Brasileira de Psiquiatria";"1999-2020";"Psychiatry and Mental Health (Q2)"
13;22364;"Revista do Instituto de Medicina Tropical de Sao Paulo";journal;"16789946, 00364665";0,461;Q2;49;78;215;1982;233;211;0,89;25,41;Brazil;Latin America;"Instituto de Medicina Tropical de Sao Paulo";"1961-2020";"Medicine (miscellaneous) (Q2); Infectious Diseases (Q3)"
14;4000151823;"Scientia Agricola";journal;"01039016";0,452;Q2;52;89;284;2672;203;276;0,72;30,02;Brazil;Latin America;"Escola Superior de Agricultura Luiz de Queiroz";"1997-2021";"Agronomy and Crop Science (Q2); Animal Science and Zoology (Q2)"
15;18349;"South African Medical Journal";journal;"02569574, 20785135";0,412;Q2;57;362;1199;3460;363;360;0,31;9,56;South Africa;Africa;"South African Medical Association";"1945-2020";"Medicine (miscellaneous) (Q2)"
16;22729;"Journal of the Brazilian Chemical Society";journal;"01035053, 16784790";0,406;Q2;70;210;613;7202;959;596;1,50;34,30;Brazil;Latin America;"Sociedade Brasileira de Quimica";"1990, 1996-2020";"Chemistry (miscellaneous) (Q2)"
17;22604;"Revista Panamericana de Salud Publica/Pan American Journal of Public Health";journal;"16805348, 10204989";0,403;Q2;57;97;327;2997;387;300;1,08;30,90;United States;Northern America;"Pan American Health Organization";"1997-2020";"Public Health, Environmental and Occupational Health (Q2)"
18;24880;"South African Journal of Science";journal;"03708462, 00382353";0,403;Q2;61;108;419;3079;295;386;0,46;28,51;South Africa;Africa;"National Research Foundation";"1973-2020";"Agricultural and Biological Sciences (miscellaneous) (Q2); Biochemistry, Genetics and Molecular Biology (miscellaneous) (Q2); Earth and Planetary Sciences (miscellaneous) (Q2)"
19;5200153106;"Neotropical Ichthyology";journal;"16796225";0,401;Q3;40;61;51;1881;39;51;0,76;30,84;Brazil;Latin America;"Sociedade Brasileira de Ictiologia";"2006-2020";"Aquatic Science (Q3)"
20;21807;"Brazilian Journal of Infectious Diseases";journal;"14138670, 16784391";0,393;Q3;45;160;226;3862;254;221;0,88;24,14;Brazil;Latin America;"Elsevier Editora Ltda";"2000-2020";"Infectious Diseases (Q3); Microbiology (medical) (Q3)"
21;13561;"Revista Chilena de Historia Natural";journal;"0716078X, 07176317";0,373;Q2;39;44;151;1789;137;149;0,76;40,66;Chile;Latin America;"Sociedad de Biologia de Chile";"2002-2020";"Agricultural and Biological Sciences (miscellaneous) (Q2); Environmental Science (miscellaneous) (Q2)"
22;60803;"Gaceta Sanitaria";journal;"02139111";0,369;Q2;42;102;344;1918;308;282;0,73;18,80;Spain;Western Europe;"Ediciones Doyma, S.L.";"1987-2020";"Public Health, Environmental and Occupational Health (Q2)"
23;18807;"Onderstepoort Journal of Veterinary Research";journal;"22190635, 00302465";0,363;Q2;35;33;128;966;58;128;0,52;29,27;South Africa;Africa;"AOSIS (Pty) Ltd";"1965-2020";"Medicine (miscellaneous) (Q2); Veterinary (miscellaneous) (Q2)"
24;21100227020;"Latin American Journal of Sedimentology and Basin Analysis";journal;"18514979, 16697316";0,362;Q2;16;8;18;306;8;18;0,44;38,25;Argentina;Latin America;"Asociacion Argentina de Sedimentologia";"2005-2020";"Geology (Q2); Paleontology (Q2); Stratigraphy (Q2)"
25;38551;"Annals of Hepatology";journal;"16652681";0,348;Q2;53;56;159;1610;180;155;0,91;28,75;Mexico;Latin America;"Mexican Association of Hepatology";"2002-2020";"Medicine (miscellaneous) (Q2); Hepatology (Q3)"
26;23092;"Revista da Sociedade Brasileira de Medicina Tropical";journal;"00378682, 16789849";0,346;Q3;52;151;420;2947;297;404;0,64;19,52;Brazil;Latin America;"Sociedade Brasileira de Medicina Tropical";"1972-1976, 1986-2020";"Infectious Diseases (Q3); Microbiology (medical) (Q3); Parasitology (Q3)"
27;145331;"Brazilian Archives of Biology and Technology";journal;"15168913";0,344;Q1;49;143;458;4653;272;458;0,47;32,54;Brazil;Latin America;"Instituto de Tecnologia do Parana";"1998-2020";"Multidisciplinary (Q1)"
28;15096;"Jornal de Pediatria";journal;"16784782, 00217557";0,343;Q2;52;139;396;3543;360;295;0,87;25,49;Brazil;Latin America;"Elsevier Editora Ltda";"1945-1965, 1973-2020";"Pediatrics, Perinatology and Child Health (Q2)"
29;18659;"Anais da Academia Brasileira de Ciencias";journal;"00013765, 16782690";0,340;Q1;58;61;201;2383;233;201;1,08;39,07;Brazil;Latin America;"Academia Brasileira de Ciencias";"1945-1946, 1949, 1970-1992, 1994-2020";"Multidisciplinary (Q1)"
30;4000148010;"Clinics";journal;"19805322, 18075932";0,337;Q2;61;132;244;3328;241;193;1,02;25,21;Brazil;Latin America;"University of Sao Paolo";"1945-1946, 2005-2020";"Medicine (miscellaneous) (Q2)"
31;24371;"Brazilian Dental Journal";journal;"01036440";0,336;Q2;50;65;160;1234;122;160;0,59;18,98;Brazil;Latin America;"Associacao Brasileira de Divulgacao Cientifica";"1990-2020";"Dentistry (miscellaneous) (Q2)"
32;12079;"Atmosfera";journal;"01876236";0,332;Q3;29;24;48;666;32;48;0,81;27,75;Mexico;Latin America;"Universidad Nacional Autonoma de Mexico";"1988-2020";"Atmospheric Science (Q3)"
33;16349;"Brazilian Journal of Chemical Engineering";journal;"01046632";0,326;Q2;52;58;193;1258;132;192;0,53;21,69;Brazil;Latin America;"Association Brasiliera de Eng. Quimica / Braz. Soc. Chem. Eng.";"1995-2020";"Chemical Engineering (miscellaneous) (Q2)"
34;21479;"Quimica Nova";journal;"01004042, 16787064";0,317;Q2;73;348;616;13333;612;595;0,98;38,31;Brazil;Latin America;"Sociedade Brasileira de Quimica";"1992, 1997-2020";"Chemistry (miscellaneous) (Q2)"
35;25359;"Revista Espanola de Enfermedades Digestivas";journal;"11300108";0,316;Q2;38;232;495;3785;283;285;0,52;16,31;Spain;Western Europe;"ARAN Ediciones S.A.";"1990-2020";"Medicine (miscellaneous) (Q2); Gastroenterology (Q3)"
36;21100228063;"Journal of the Southern African Institute of Mining and Metallurgy";journal;"22256253";0,314;Q2;37;101;288;1277;52;275;0,18;12,64;South Africa;Africa;"South African Institute of Mining and Metallurgy";"1988, 2006-2020";"Geotechnical Engineering and Engineering Geology (Q2); Materials Chemistry (Q2); Metals and Alloys (Q2)"
37;72196;"Pesquisa Agropecuaria Brasileira";journal;"0100204X, 16783921";0,313;Q3;56;240;611;5376;258;609;0,34;22,40;Brazil;Latin America;"Embrapa";"1978, 1983-1984, 1986-1987, 1996-2020";"Agronomy and Crop Science (Q3); Animal Science and Zoology (Q3)"
38;4300151406;"Revista Brasileira de Entomologia";journal;"00855626, 18069665";0,312;Q3;31;81;81;1892;34;81;0,42;23,36;Brazil;Latin America;"Sociedade Brasileira de Entomologia";"2003, 2005-2020";"Insect Science (Q3)"
39;13841;"Brazilian Journal of Biology";journal;"15196984, 16784375";0,305;Q2;53;145;326;4030;159;315;0,38;27,79;Brazil;Latin America;"Instituto Internacional de Ecologia";"2000-2020";"Agricultural and Biological Sciences (miscellaneous) (Q2)"
40;29389;"Revista Latino-Americana de Enfermagem";journal;"01041169";0,298;Q2;36;173;415;2642;200;393;0,40;15,27;Brazil;Latin America;"University of Sao Paulo, Ribeirao Preto College of Nursing Organisation";"1993-2020";"Nursing (miscellaneous) (Q2)"
41;61695;"Journal of the South African Veterinary Association";journal;"10199128, 22249435";0,296;Q2;31;43;131;1037;69;125;0,47;24,12;South Africa;Africa;"AOSIS (Pty) Ltd";"1945, 1948, 1961, 1971-2020";"Medicine (miscellaneous) (Q2); Veterinary (miscellaneous) (Q3)"
42;52142;"Pesquisa odontologica brasileira = Brazilian oral research";journal;"15177491";0,292;Q2;45;68;175;1498;104;169;0,53;22,03;Brazil;Latin America;"University of Sao Paolo";"2001-2020";"Medicine (miscellaneous) (Q2); Dentistry (miscellaneous) (Q3)"
43;18819;"Pesquisa Veterinaria Brasileira";journal;"0100736X, 16785150";0,292;Q3;35;87;127;2394;76;123;0,66;27,52;Brazil;Latin America;"Colegio Brasileiro de Patologia Animal";"1996-2020";"Veterinary (miscellaneous) (Q3)"
44;13900154710;"Latin American Journal of Solids and Structures";journal;"16797825, 16797817";0,275;Q2;32;17;64;289;15;57;0,16;17,00;Brazil;Latin America;"Brazilian Association of Computational Mechanics";"2003-2020";"Aerospace Engineering (Q2); Automotive Engineering (Q2); Materials Science (miscellaneous) (Q2); Mechanical Engineering (Q2); Ocean Engineering (Q2); Civil and Structural Engineering (Q3); Mechanics of Materials (Q3)"
45;4800153106;"Acta Botanica Brasilica";journal;"01023306";0,274;Q3;47;88;281;3409;129;279;0,34;38,74;Brazil;Latin America;"Sociedade Botanica de Sao Paulo";"1997-2020";"Plant Science (Q3)"
46;26806;"Ciencias Marinas";journal;"01853880";0,259;Q4;29;40;182;1548;96;180;0,55;38,70;Mexico;Latin America;"Universidad Autonoma de Baja California";"1992-2020";"Aquatic Science (Q4)"
47;17672;"Arquivo Brasileiro de Medicina Veterinaria e Zootecnia";journal;"01020935, 16784162";0,257;Q3;33;257;475;5078;120;475;0,22;19,76;Brazil;Latin America;"Universidade de Minas Gerais";"1996-2020";"Veterinary (miscellaneous) (Q3)"
48;14224;"Arquivos de Neuro-Psiquiatria";journal;"16784227, 0004282X";0,255;Q3;48;278;650;6071;431;635;0,54;21,84;Brazil;Latin America;"Arquivos de Neuro-Psiquiatria";"1945-1965, 1971-2020";"Biological Psychiatry (Q3); Neurology (clinical) (Q3)"
49;15601;"Gayana - Botanica";journal;"00165301, 07176643";0,251;Q3;16;23;45;666;21;45;0,48;28,96;Chile;Latin America;"Universidad de Concepcion";"1981-1982, 1984, 2002-2019";"Ecology (Q3); Horticulture (Q3); Plant Science (Q3)"
50;19930;"International braz j urol : official journal of the Brazilian Society of Urology";journal;"16776119, 16775538";0,250;Q2;39;332;596;2209;182;324;0,25;6,65;Brazil;Latin America;"Brazilian Society of Urology";"2002-2020";"Urology (Q2); Medicine (miscellaneous) (Q3)"
51;22599;"Revista Espanola de Salud Publica";journal;"21739110, 11355727, 16969820";0,244;Q3;35;60;168;1750;127;144;0,63;29,17;Spain;Western Europe;"Ministerio de Sanidad y Consumo";"1995-2020";"Medicine (miscellaneous) (Q3); Public Health, Environmental and Occupational Health (Q3)"
52;22186;"Genetics and Molecular Biology";journal;"14154757, 16784685";0,242;Q4;55;138;367;5089;233;364;0,54;36,88;Brazil;Latin America;"Brazilian Society of Genetics";"1998-2020";"Genetics (Q4); Molecular Biology (Q4)"
53;28247;"Arquivos de Gastroenterologia";journal;"16784219, 00042803";0,240;Q3;30;67;169;2071;91;156;0,55;30,91;Brazil;Latin America;"IBEPEGE - Inst. Bras. Estudos Pesquisas Gastroent.";"1973-2020";"Gastroenterology (Q3)"
54;27018;"Journal of Energy in Southern Africa";trade journal;"1021447X";0,239;Q2;20;26;71;407;13;71;0,15;15,65;South Africa;Africa;"Energy Research Institute, University of Cape Town";"1993-2007, 2009-2020";"Computer Science (miscellaneous) (Q2); Energy (miscellaneous) (Q2)"
55;29996;"Archivos Latinoamericanos de Nutricion";journal;"00040622";0,238;Q3;34;53;192;1726;112;187;0,36;32,57;Venezuela;Latin America;"Archivos Latinoamericanos Nutricion";"1971-2019";"Medicine (miscellaneous) (Q3); Nutrition and Dietetics (Q3)"
56;19317;"Salud Publica de Mexico";journal;"16067916, 00363634";0,236;Q3;54;250;264;3871;143;217;0,49;15,48;Mexico;Latin America;"Instituto Nacional de Salud Publica";"1961-2020";"Public Health, Environmental and Occupational Health (Q3)"
57;14594;"Social Work/Maatskaplike Werk";journal;"00378054";0,231;Q3;15;38;106;1344;44;104;0,42;35,37;South Africa;Africa;"University of Stellenbosch";"1972-1978, 1994-2020";"Social Work (Q3); Sociology and Political Science (Q3)"
58;4300151410;"Revista Arvore";journal;"01006762";0,230;Q2;30;123;100;3056;26;100;0,26;24,85;Brazil;Latin America;"Sociedade de Investigacoes Florestais";"2006-2020";"Forestry (Q2)"
59;14786;"Nutricion Hospitalaria";journal;"16995198, 02121611";0,229;Q3;53;112;264;4294;210;241;0,84;38,34;Spain;Western Europe;"ARAN Ediciones S.A.";"1989-2020";"Medicine (miscellaneous) (Q3); Nutrition and Dietetics (Q3)"
60;100147322;"Materials Research";journal;"15161439";0,227;Q2;49;84;162;1778;61;155;0,38;21,17;Brazil;Latin America;"Universidade Federal de Sao Carlos";"2005-2020";"Mechanical Engineering (Q2); Materials Science (miscellaneous) (Q3); Mechanics of Materials (Q3); Condensed Matter Physics (Q4)"
61;30008;"Revista da Escola de Enfermagem da U S P";journal;"00806234";0,227;Q2;28;115;196;2005;66;189;0,31;17,43;Brazil;Latin America;"University of Sao Paolo";"1967-2020";"Nursing (miscellaneous) (Q2)"
62;13565;"Revista de Biologia Marina y Oceanografia";journal;"07173326";0,225;Q3;25;37;60;1259;22;60;0,39;34,03;Chile;Latin America;"Universidad de Valparaiso";"1996-2020";"Oceanography (Q3); Aquatic Science (Q4)"
63;18852;"Revista Brasileira de Zootecnia";journal;"18069290, 15163598";0,223;Q4;53;270;830;7459;362;830;0,40;27,63;Brazil;Latin America;"Sociedade Brasileira de Zootecnia";"1996-2020";"Animal Science and Zoology (Q4)"
64;38490;"Bragantia";journal;"00068705";0,218;Q2;32;85;202;1969;47;200;0,20;23,16;Brazil;Latin America;"Instituto Agronomico";"1977, 1979, 1985, 1992-2020";"Agricultural and Biological Sciences (miscellaneous) (Q2); Materials Science (miscellaneous) (Q3)"
65;4500151501;"Planta Daninha";journal;"01008358";0,218;Q3;31;100;99;2129;43;99;0,43;21,29;Brazil;Latin America;"Sociedade Brasileira da Ciencia das Plantas Daninhas";"2006-2020";"Agronomy and Crop Science (Q3); Plant Science (Q3); Biochemistry (Q4); Physiology (Q4)"
66;130143;"Brazilian Journal of Microbiology";journal;"15178382";0,213;Q4;64;144;243;3843;154;243;0,42;26,69;Brazil;Latin America;"Elsevier Editora Ltda";"2000-2020";"Microbiology (Q4)"
67;20365;"Revista Argentina de Microbiologia";journal;"03257541";0,210;Q3;26;52;133;858;58;129;0,44;16,50;Spain;Western Europe;"Elsevier Doyma";"1979-2020";"Medicine (miscellaneous) (Q3); Microbiology (medical) (Q3); Microbiology (Q4)"
68;21028;"Cirugia Plastica Ibero-Latinoamericana";journal;"03767892";0,209;Q3;10;61;166;573;10;98;0,07;9,39;Spain;Western Europe;"Sociedad Espanola de Cirugia Plastica Reparadora y Estetica (SECPRE)";"1975-2002, 2004-2020";"Surgery (Q3)"
69;19700201507;"Zoologia";journal;"19844689, 19844670";0,209;Q4;32;150;153;4360;51;153;0,33;29,07;Brazil;Latin America;"Sociedade Brasileira de Zoologia";"2009-2020";"Animal Science and Zoology (Q4)"
70;18748;"Acta Amazonica";journal;"00445967";0,206;Q3;30;85;70;2410;14;70;0,20;28,35;Brazil;Latin America;"Instituto Nacional de Pesquisas da Amazonia";"1979, 2006-2020";"Agricultural and Biological Sciences (miscellaneous) (Q3)"
71;15162;"Eure";journal;"07176236, 02507161";0,206;Q3;27;22;59;926;17;59;0,18;42,09;Chile;Latin America;"Pontificia Universidad Catolica de Chile";"1979, 1982, 1996-1998, 2001-2020";"Urban Studies (Q3)"
72;21100268426;"Journal of Seed Science";journal;"23171537";0,206;Q3;27;82;80;1841;13;80;0,16;22,45;Brazil;Latin America;"Associacao Brasileira de Tecnologia de Sementes";"2013-2020";"Agronomy and Crop Science (Q3)"
73;19332;"Salud Mental";journal;"01853325";0,203;Q3;24;58;160;2135;56;157;0,35;36,81;Mexico;Latin America;"Elsevier GmbH";"1995-2020";"Clinical Psychology (Q3); Psychiatry and Mental Health (Q3)"
74;15234;"Investigacion Clinica";journal;"05355133";0,201;Q3;21;49;106;1702;50;99;0,43;34,73;Venezuela;Latin America;"";"1961, 1972-1986, 1988-2020";"Medicine (miscellaneous) (Q3)"
75;18259;"Revista Medica de Chile";journal;"07176163, 00349887";0,201;Q3;38;222;641;5304;286;588;0,44;23,89;Chile;Latin America;"Sociedad Medica de Santiago";"1945-2020";"Medicine (miscellaneous) (Q3)"
76;77291;"Biomedica";journal;"01204157";0,200;Q3;28;75;232;2670;109;212;0,47;35,60;Colombia;Latin America;"Instituto Nacional de Salud";"2001-2020";"Biochemistry, Genetics and Molecular Biology (miscellaneous) (Q3); Medicine (miscellaneous) (Q3)"
77;600147001;"Gerokomos";journal;"1134928X";0,197;Q3;11;27;51;596;11;43;0,22;22,07;Spain;Western Europe;"Spanish Publishers Associates";"2005-2020";"Geriatrics and Gerontology (Q3)"
78;23432;"Journal of the Chilean Chemical Society";journal;"07179324, 07179707";0,197;Q3;31;68;187;1780;85;187;0,31;26,18;Chile;Latin America;"Sociedad Chilena De Quimica";"2003-2020";"Chemistry (miscellaneous) (Q3)"
79;28002;"Revista de Nutricao";journal;"14155273";0,196;Q3;36;61;191;2045;81;190;0,34;33,52;Brazil;Latin America;"";"2000-2020";"Medicine (miscellaneous) (Q3); Nutrition and Dietetics (Q3)"
80;4000152107;"Journal of Venomous Animals and Toxins Including Tropical Diseases";journal;"16789199";0,195;Q4;30;51;60;1440;16;56;0,27;28,24;United Kingdom;Western Europe;"Centro de Estudos de Venenos e Animais Peconhentos";"2006-2020";"Animal Science and Zoology (Q4); Infectious Diseases (Q4); Parasitology (Q4); Toxicology (Q4)"
81;23044;"Revista Cubana de Medicina Tropical";journal;"03750760, 15613054";0,195;Q3;18;51;126;803;18;124;0,13;15,75;Cuba;Latin America;"Editorial Ciencias Medicas";"1976-2020";"Infectious Diseases (Q3); Parasitology (Q4)"
82;19400158712;"Chilean Journal of Agricultural Research";journal;"07185820, 07185839";0,193;Q3;31;51;44;1163;10;44;0,23;22,80;Chile;Latin America;"Instituto de Investigaciones Agropecuarias, INIA";"2008-2020";"Agronomy and Crop Science (Q3); Animal Science and Zoology (Q4)"
83;25953;"Dados";journal;"16784588, 00115258";0,192;Q3;26;27;74;984;12;74;0,16;36,44;Brazil;Latin America;"Inst. Univ. de Pesquisas do Rio de Janeiro";"1996-2020";"Social Sciences (miscellaneous) (Q3)"
84;21100264507;"Revista Peruana de Biologia";journal;"17279933, 15610837";0,192;Q3;20;75;261;1675;21;251;0,05;22,33;Peru;Latin America;"Asociacion de Biologos de la Universidad Nacional Mayor de San Marcos";"1974, 1980, 1990, 1992, 1998-2020";"Agricultural and Biological Sciences (miscellaneous) (Q3)"
85;146161;"Acta Cirurgica Brasileira";journal;"01028650";0,191;Q3;30;117;310;2095;102;301;0,34;17,91;Brazil;Latin America;"Sociedade Brasileira para o Desenvolvimento de Pesquisa em Cirurgia";"2002-2020";"Surgery (Q3)"
86;33067;"Arquivos Brasileiros de Cardiologia";journal;"0066782X";0,190;Q3;53;253;669;6395;293;608;0,45;25,28;Brazil;Latin America;"Arquivos Brasileiros de Cardiologia";"1950-2020";"Cardiology and Cardiovascular Medicine (Q3)"
87;17323;"Bothalia";journal;"23119284, 00068241";0,190;Q4;20;32;99;662;15;99;0,14;20,69;South Africa;Africa;"AOSIS (Pty) Ltd";"1978, 1993-2019";"Ecology, Evolution, Behavior and Systematics (Q4); Plant Science (Q4)"
88;18825;"Sao Paulo Medical Journal";journal;"15163180, 18069460";0,190;Q3;40;83;255;1715;153;232;0,46;20,66;Brazil;Latin America;"Associacao Paulista de Medicina";"1994-2020";"Medicine (miscellaneous) (Q3)"
89;13302;"Arquivos Brasileiros de Oftalmologia";journal;"16782925, 00042749";0,189;Q3;29;194;528;3985;126;487;0,26;20,54;Brazil;Latin America;"Conselho Brasileiro De Oftalmologia";"1945, 1949, 1960-1977, 1979-1994, 2000-2020";"Medicine (miscellaneous) (Q3); Ophthalmology (Q3)"
90;37267;"Cuban Journal of Agricultural Science";journal;"08640408";0,189;Q4;12;64;185;1446;22;184;0,13;22,59;Cuba;Latin America;"Instituto de Ciencia Animal";"1981, 1996-2016";"Animal Science and Zoology (Q4)"
91;14730;"Revista Latinoamericana de Psicologia";journal;"01200534";0,189;Q3;27;37;92;1652;27;90;0,28;44,65;Colombia;Latin America;"Konrad Lorenz Editores";"1980, 1984, 1992, 1996-2020";"Psychology (miscellaneous) (Q3); Social Sciences (miscellaneous) (Q3)"
92;4700152616;"Chungara";journal;"07161182";0,188;Q2;24;15;118;849;16;117;0,00;56,60;Chile;Latin America;"Universidad de Tarapaca";"2000-2002, 2004, 2006-2020";"Archeology (Q2); Anthropology (Q3)"
93;15788;"Revista Cubana de Pediatria";journal;"00347531, 15613119";0,188;Q3;10;48;69;1371;5;69;0,07;28,56;Cuba;Latin America;"Editorial Ciencias Medicas";"1946-1963, 1972-1977, 1988-1991, 1996-2002, 2005-2020";"Pediatrics, Perinatology and Child Health (Q3)"
94;54988;"South African Journal of Animal Sciences";journal;"03751589";0,186;Q4;33;35;243;1034;58;243;0,18;29,54;South Africa;Africa;"Bureau for Scientific Publications";"1974, 1996-2020";"Animal Science and Zoology (Q4)"
95;24740;"Latin American Applied Research";journal;"03270793";0,185;Q2;23;47;142;791;48;139;0,32;16,83;Argentina;Latin America;"PLAPIQUI Planta Piloto de Ingenieria Quimica, CONICET / Universidad Nacional del Sur";"1996-2020";"Chemical Engineering (miscellaneous) (Q2); Chemistry (miscellaneous) (Q3); Mechanical Engineering (Q3)"
96;14784;"Historia, Ciencias, Saude - Manguinhos";journal;"16784758, 01045970";0,184;Q2;18;80;142;2348;17;136;0,07;29,35;Brazil;Latin America;"Fundacao Oswaldo Cruz";"1994-2020";"History and Philosophy of Science (Q2); Medicine (miscellaneous) (Q3)"
97;16100154756;"Lexikos";journal;"16844904";0,184;Q2;15;33;74;413;19;65;0,20;12,52;South Africa;Africa;"";"2002-2019";"Language and Linguistics (Q2); Linguistics and Language (Q2)"
98;19700182901;"Brazilian Journal of Pharmaceutical Sciences";journal;"19848250, 21759790";0,183;Q3;40;72;177;2184;68;168;0,41;30,33;Brazil;Latin America;"Faculdade de Ciencias Farmaceuticas (Biblioteca-";"2009-2020";"Pharmacology, Toxicology and Pharmaceutics (miscellaneous) (Q3)"
99;12400154701;"Latin American Journal of Aquatic Research";journal;"0718560X";0,183;Q3;28;26;83;841;17;83;0,14;32,35;Chile;Latin America;"Pontificia Universidad Catolica de Valparaiso";"2008-2020";"Oceanography (Q3); Aquatic Science (Q4)"
100;29758;"Revista Mexicana de Fisica";journal;"0035001X";0,181;Q3;25;185;412;3268;100;410;0,22;17,66;Mexico;Latin America;"Sociedad Mexicana de Fisica";"1991-1993, 1995-2020";"Education (Q3); Physics and Astronomy (miscellaneous) (Q4)"
101;20856;"West Indian Medical Journal";journal;"00433144";0,181;Q3;31;119;302;2493;92;253;0,20;20,95;Jamaica;Latin America;"University of the West Indies";"1954-2019";"Medicine (miscellaneous) (Q3)"
102;17944;"Darwiniana";journal;"00116793";0,179;Q4;21;47;63;680;19;63;0,26;14,47;Argentina;Latin America;"Instituto de Botanica Darwinion";"1985-1986, 1989-1990, 1992-1993, 1995-2020";"Plant Science (Q4)"
103;4700152859;"Maderas: Ciencia y Tecnologia";journal;"07173644, 0718221X";0,177;Q2;26;27;20;509;5;20;0,25;18,85;Chile;Latin America;"Universidade Federal de Sao Carlos";"2001-2002, 2006-2020";"Industrial and Manufacturing Engineering (Q2); Chemical Engineering (miscellaneous) (Q3); Forestry (Q3); Materials Science (miscellaneous) (Q3)"
104;4700152203;"Revista Brasileira de Saude Materno Infantil";journal;"15193829";0,175;Q3;20;62;73;1501;17;69;0,23;24,21;Brazil;Latin America;"Instituto Materno Infantil Professor Fernando Figueira";"2002, 2005-2020";"Obstetrics and Gynecology (Q3); Pediatrics, Perinatology and Child Health (Q3); Public Health, Environmental and Occupational Health (Q3)"
105;13562;"Revista Cubana de Investigaciones Biomedicas";journal;"15613011, 08640300";0,175;Q3;11;39;96;890;11;95;0,12;22,82;Cuba;Latin America;"Editorial Ciencias Medicas";"1988-1992, 1996-2020";"Medicine (miscellaneous) (Q3)"
