Rank;Sourceid;Title;Type;Issn;SJR;SJR Best Quartile;H index;Total Docs. (2006);Total Docs. (3years);Total Refs.;Total Cites (3years);Citable Docs. (3years);Cites / Doc. (2years);Ref. / Doc.;Country;Region;Publisher;Coverage;Categories
1441;83082;"Historia Agraria";journal;"11391472";0,111;Q3;15;19;54;837;3;54;0,08;44,05;Spain;Western Europe;"Universitat Autonoma de Barcelona";"1998-2020";"History (Q3); Agricultural and Biological Sciences (miscellaneous) (Q4); Arts and Humanities (miscellaneous) (Q4); Geography, Planning and Development (Q4)"
1442;19700182325;"Investment Management and Financial Innovations";journal;"18104967, 18129358";0,111;Q3;18;49;91;1412;7;91;0,08;28,82;Ukraine;Eastern Europe;"Business Perspectives";"2004-2020";"Business and International Management (Q3); Economics and Econometrics (Q4); Finance (Q4); Strategy and Management (Q4)"
1443;16200154758;"Japanese Journal of Religious Studies";journal;"03041042";0,111;Q2;12;14;43;690;5;41;0,06;49,29;Japan;Asiatic Region;"Nanzan Institute for Religion and Culture";"2002-2019";"Religious Studies (Q2)"
1444;12805;"Journal of Educational Enquiry";journal;"14445530";0,111;Q4;17;0;29;0;4;29;0,10;0,00;Australia;Pacific Region;"University of South Australia";"2000-2005, 2007-2008, 2011, 2013-2016";"Education (Q4)"
1445;12259;"Journal of Orthopaedics and Traumatology";journal;"15909921, 15909999";0,111;Q4;38;39;108;789;14;104;0,15;20,23;Italy;Western Europe;"Springer-Verlag Italia";"2002-2020";"Medicine (miscellaneous) (Q4); Orthopedics and Sports Medicine (Q4); Surgery (Q4)"
1446;16100154756;"Lexikos";journal;"16844904";0,111;Q3;15;24;73;342;8;64;0,08;14,25;South Africa;Africa;"";"2002-2019";"Language and Linguistics (Q3); Linguistics and Language (Q3)"
1447;21100465408;"Medical Journal of Indonesia";journal;"22528083, 08531773";0,111;Q4;9;40;128;666;3;128;0,02;16,65;Indonesia;Asiatic Region;"Faculty of Medicine Universitas Indonesia";"1994-2020";"Medicine (miscellaneous) (Q4)"
1448;18364;"Medicina";journal;"00766046, 21767262";0,111;Q4;10;55;112;1670;6;111;0,08;30,36;Brazil;Latin America;"Faculdade de Medicina da Universidade de Sao Paulo";"1991-2020";"Medicine (miscellaneous) (Q4)"
1449;23317;"Polarforschung";journal;"00322490";0,111;Q4;24;14;42;373;3;42;0,03;26,64;Germany;Western Europe;"Deutsche Gesellschaft fur Polarforschung e.V.";"1978-1980, 1982, 1984-1985, 1988-1990, 1992-1997, 1999-2006, 2008-2014, 2016-2018";"Oceanography (Q4)"
1450;4700152203;"Revista Brasileira de Saude Materno Infantil";journal;"15193829";0,111;Q3;20;64;9;1571;1;9;0,11;24,55;Brazil;Latin America;"Instituto Materno Infantil Professor Fernando Figueira";"2002, 2005-2020";"Obstetrics and Gynecology (Q3); Pediatrics, Perinatology and Child Health (Q4); Public Health, Environmental and Occupational Health (Q4)"
1451;30008;"Revista da Escola de Enfermagem da U S P";journal;"00806234";0,111;Q4;28;75;170;177;17;164;0,10;2,36;Brazil;Latin America;"University of Sao Paolo";"1967-2020";"Nursing (miscellaneous) (Q4)"
1452;26283;"Revista Galega de Economia";journal;"11322799, 22555951";0,111;Q4;6;31;71;680;1;71;0,02;21,94;Spain;Western Europe;"Universidad de Santiago de Compostela";"2001, 2003-2020";"Economics and Econometrics (Q4)"
1453;101730;"Rudarsko Geolosko Naftni Zbornik";journal;"03534529";0,111;Q3;12;10;35;195;1;33;0,05;19,50;Croatia;Eastern Europe;"University of Zagreb";"1994-2020";"Energy (miscellaneous) (Q3); Geotechnical Engineering and Engineering Geology (Q3); Geology (Q4); Water Science and Technology (Q4)"
1454;64744;"Salus";journal;"13167138";0,111;Q4;5;21;61;351;3;54;0,05;16,71;Venezuela;Latin America;"Revista Salus";"2002-2018";"Medicine (miscellaneous) (Q4)"
1455;28607;"South African Journal of Obstetrics and Gynaecology";journal;"23058862, 00382329";0,111;Q3;8;26;41;313;1;27;0,04;12,04;South Africa;Africa;"South African Medical Association";"1968, 1970-1972, 1999-2020";"Obstetrics and Gynecology (Q3)"
1456;93433;"Southern African Journal of HIV Medicine";journal;"16089693";0,111;Q4;18;47;138;714;4;88;0,05;15,19;South Africa;Africa;"AOSIS (Pty) Ltd";"2001-2020";"Infectious Diseases (Q4)"
1457;19544;"Srpski Arhiv Za Celokupno Lekarstvo";journal;"03708179";0,111;Q4;17;125;265;625;28;265;0,09;5,00;Serbia;Eastern Europe;"Srpsko Lekarsko Drutsvo";"1950-2020";"Medicine (miscellaneous) (Q4)"
1458;97509;"Tekstilna Industrija";journal;"00402389";0,111;Q3;4;22;57;311;2;57;0,00;14,14;Serbia;Eastern Europe;"";"1988, 1991, 1995-2009";"Business and International Management (Q3); Industrial and Manufacturing Engineering (Q3); Polymers and Plastics (Q3); Agricultural and Biological Sciences (miscellaneous) (Q4)"
1459;67736;"Tribology in Industry";journal;"03548996";0,111;Q4;23;10;50;96;1;50;0,03;9,60;Serbia;Eastern Europe;"Masinski Fakultet - Kragujevac";"1997-2020";"Mechanical Engineering (Q4); Mechanics of Materials (Q4); Surfaces and Interfaces (Q4); Surfaces, Coatings and Films (Q4)"
1460;93511;"Turk Kardiyoloji Dernegi Arsivi";journal;"10165169, 13084488";0,111;Q4;24;96;202;1756;7;197;0,02;18,29;Turkey;Middle East;"Turkish Anaesthesiology and Intensive Care Society";"1990-2020";"Cardiology and Cardiovascular Medicine (Q4)"
1461;20828;"Vojnosanitetski Pregled";journal;"24060720, 00428450";0,111;Q4;19;162;317;892;42;308;0,11;5,51;Serbia;Eastern Europe;"Institut za Vojnomedicinske Naucne Informacije/Documentaciju";"1949-2020";"Medicine (miscellaneous) (Q4); Pharmacology (medical) (Q4)"
1462;17606;"African Journal of Neurological Sciences (discontinued)";journal;"10158618, 19922647";0,110;Q4;11;25;64;364;2;55;0,02;14,56;Egypt;Africa/Middle East;"Pan African Association of Neurological Sciences";"1982, 1988-1999, 2001-2017";"Neurology (Q4); Neurology (clinical) (Q4)"
1463;28729;"Archive of Oncology";journal;"14509520, 03547310";0,110;Q4;13;57;142;1262;15;130;0,09;22,14;Serbia;Eastern Europe;"Institute of Oncology Sremska Kamenica";"1997-2013, 2017-2020";"Hematology (Q4); Oncology (Q4)"
1464;21100284241;"Basic and Clinical Andrology";journal;"20514190";0,110;Q4;18;27;153;946;16;144;0,09;35,04;United Kingdom;Western Europe;"BioMed Central Ltd.";"2009, 2013-2020";"Reproductive Medicine (Q4); Urology (Q4)"
1465;15543;"Biotecnologia Aplicada";journal;"10272852, 08644551";0,110;Q4;15;39;131;1575;13;129;0,06;40,38;Cuba;Latin America;"Elfos Scientiae";"1990-1992, 1998-2019";"Applied Microbiology and Biotechnology (Q4); Biotechnology (Q4)"
1466;13807;"Cailiao Gongcheng/Journal of Materials Engineering";journal;"10014381";0,110;Q3;18;314;459;3711;43;459;0,08;11,82;China;Asiatic Region;"Beijing Institute of Aeronautical Materials (BIAM)";"1993-2020";"Aerospace Engineering (Q3)"
1467;21100309828;"CoDAS";journal;"23171782";0,110;Q4;23;34;78;157;3;74;0,04;4,62;Brazil;Latin America;"Brazilian Society of Speech-Language Pathology and Audiology";"2013-2020";"Otorhinolaryngology (Q4); Speech and Hearing (Q4)"
1468;25953;"Dados";journal;"16784588, 00115258";0,110;Q4;26;26;73;990;7;73;0,06;38,08;Brazil;Latin America;"Inst. Univ. de Pesquisas do Rio de Janeiro";"1996-2020";"Social Sciences (miscellaneous) (Q4)"
1469;25985;"Diogenes";journal;"14677695, 03921921";0,110;Q3;16;47;148;575;10;135;0,06;12,23;United Kingdom;Western Europe;"SAGE Publications Ltd";"1975, 1977-1979, 1981, 1983, 1986-1988, 1996-2000, 2002-2013, 2015";"Cultural Studies (Q3); Arts and Humanities (miscellaneous) (Q4)"
1470;20362;"Electronic Green Journal";journal;"10767975";0,110;Q4;13;12;63;371;7;57;0,24;30,92;United States;Northern America;"University of Idaho Library";"2001-2020";"Geography, Planning and Development (Q4)"
1471;13481;"Hrvatski Meteoroloski Casopis/Croatian Meteorological Journal";journal;"13300083";0,110;Q4;9;6;242;100;17;241;0,07;16,67;Croatia;Eastern Europe;"Hrvatsko Meteorolosko Drustvo";"1991-1998, 2000-2001, 2003-2008, 2011-2013, 2015-2017";"Atmospheric Science (Q4)"
1472;16300154716;"Journal for the Study of Religions and Ideologies";journal;"15830039";0,110;Q3;12;38;106;742;3;106;0,03;19,53;Romania;Eastern Europe;"Universitatea Babes-Bolyai, Catedra de Filosofie Sistematica";"2002-2020";"Philosophy (Q3); Religious Studies (Q3)"
1473;19700170495;"LIBER Quarterly";journal;"14355205";0,110;Q4;15;41;120;283;7;110;0,08;6,90;Netherlands;Western Europe;"";"1999-2020";"Library and Information Sciences (Q4)"
1474;17866;"Radiology and Oncology";journal;"13182099, 15813207";0,110;Q4;30;53;128;1221;17;126;0,11;23,04;Germany;Western Europe;"Walter de Gruyter";"1992-2020";"Oncology (Q4); Radiology, Nuclear Medicine and Imaging (Q4)"
1475;17600155222;"Renewable Energy Focus";trade journal;"18780229, 17550084";0,110;Q4;22;86;272;86;21;233;0,07;1,00;United Kingdom;Western Europe;"Elsevier Ltd.";"2007-2020";"Renewable Energy, Sustainability and the Environment (Q4)"
1476;19753;"Revista Brasileira de Reumatologia";journal;"04825004, 18094570";0,110;Q4;0;0;0;0;0;0;0,00;0,00;Brazil;Latin America;"Elsevier Editora Ltda";"1997-2000, 2003-2017";"Rheumatology (Q4)"
1477;130070;"Wspolczesna Onkologia";journal;"14282526";0,110;Q4;23;87;90;2571;15;90;0,17;29,55;Poland;Eastern Europe;"Termedia Publishing House Ltd.";"2005-2020";"Oncology (Q4); Radiology, Nuclear Medicine and Imaging (Q4)"
1478;26440;"Polimery w medycynie";journal;"03700747";0,109;Q4;11;23;60;90;12;60;0,17;3,91;Poland;Eastern Europe;"Wroclaw Medical University";"1974-2016, 2019-2020";"Medicine (miscellaneous) (Q4)"
1479;145237;"Przeglad Menopauzalny";journal;"16438876";0,109;Q4;18;70;66;1863;6;65;0,09;26,61;Poland;Eastern Europe;"Termedia Publishing House Ltd.";"2005-2020";"Endocrinology, Diabetes and Metabolism (Q4); Obstetrics and Gynecology (Q4)"
1480;17701;"Qatar Medical Journal";journal;"22270426, 02538253";0,109;Q4;9;41;93;623;2;82;0,00;15,20;Qatar;Middle East;"Hamad Medical Corporation";"2000-2017, 2019-2020";"Medicine (miscellaneous) (Q4)"
1481;19900191824;"Sultan Qaboos University Medical Journal";journal;"20750528, 2075051X";0,109;Q4;27;24;10;577;2;9;0,00;24,04;Oman;Middle East;"Sultan Qaboos University";"2000-2003, 2006-2020";"Medicine (miscellaneous) (Q4)"
1482;19655;"Terapevticheskii Arkhiv";journal;"23095342, 00403660";0,109;Q4;14;233;785;4839;53;752;0,04;20,77;Russian Federation;Eastern Europe;"Consilium Medikum";"1949-2020";"Medicine (miscellaneous) (Q4)"
1483;21733;"Balkan Journal of Medical Genetics";journal;"13110160";0,108;Q4;12;10;59;271;7;58;0,00;27,10;Macedonia;Eastern Europe;"Macedonian Academy of Sciences and Arts";"2000-2019";"Genetics (Q4); Genetics (clinical) (Q4)"
1484;26067;"Endokrynologia Polska";journal;"0423104X";0,108;Q4;27;91;82;2435;13;78;0,16;26,76;Poland;Eastern Europe;"Via Medica";"1961-1989, 1991-1993, 2005-2020";"Endocrinology (Q4)"
1485;21100205706;"Gastroenterologie a Hepatologie";journal;"18047874, 1804803X";0,108;Q4;9;38;112;979;13;112;0,11;25,76;Czech Republic;Eastern Europe;"Czech Medical Association J.E. Purkyne";"2011-2020";"Gastroenterology (Q4); Hepatology (Q4)"
1486;22385;"International maritime health";journal;"16419251, 20813252";0,108;Q4;17;22;55;101;9;53;0,03;4,59;Poland;Eastern Europe;"Institute of Maritime and Tropical Medicine";"1999-2020";"Medicine (miscellaneous) (Q4)"
1487;145396;"Journal of Minimal Access Surgery";journal;"09729941";0,108;Q4;26;46;38;671;8;31;0,21;14,59;India;Asiatic Region;"Wolters Kluwer Medknow Publications";"2005-2020";"Surgery (Q4)"
1488;72149;"Journal of the National Institute of Information and Communications Technology";journal;"13493205";0,108;Q3;10;60;124;748;8;121;0,09;12,47;Japan;Asiatic Region;"National Institute of Information and Communications Technology";"2003-2017";"Media Technology (Q3); Electrical and Electronic Engineering (Q4)"
1489;16882;"Periodica Polytechnica: Civil Engineering";journal;"05536626, 15873773";0,108;Q3;19;18;48;230;4;48;0,13;12,78;Hungary;Eastern Europe;"Budapest University of Technology and Economics";"1972-1974, 1977, 1979-1983, 1985-2020";"Geotechnical Engineering and Engineering Geology (Q3); Civil and Structural Engineering (Q4)"
1490;29385;"Revista brasileira de enfermagem";journal;"00347167";0,108;Q4;21;128;383;442;36;375;0,06;3,45;Brazil;Latin America;"Associacao Brasileira de Enfermagem";"1965, 1967-1971, 1973, 1976-1979, 1983-1987, 1995-2020";"Medicine (miscellaneous) (Q4)"
1491;144682;"South African Family Practice";journal;"10251979, 1726426X";0,108;Q4;18;145;441;1303;8;355;0,02;8,99;United Kingdom;Western Europe;"Taylor and Francis Ltd.";"2000-2020";"Family Practice (Q4); Public Health, Environmental and Occupational Health (Q4)"
1492;21287;"Acta Medica Mediterranea";journal;"03936384";0,107;Q4;21;33;105;613;2;104;0,00;18,58;Italy;Western Europe;"A. CARBONE Editore";"2003-2020";"Medicine (miscellaneous) (Q4)"
1493;19700173166;"Acta Polytechnica Hungarica";journal;"17858860";0,107;Q3;34;29;33;458;3;33;0,09;15,79;Hungary;Eastern Europe;"Obuda University";"2004-2020";"Engineering (miscellaneous) (Q3); Multidisciplinary (Q4)"
1494;21434;"Anestesia en Mexico";journal;"14050056";0,107;Q4;5;50;47;1073;4;33;0,09;21,46;Mexico;Latin America;"Comunicaciones Cientificas Mexicanas S.A. de C.V.";"1997-1999, 2005-2009";"Anesthesiology and Pain Medicine (Q4)"
1495;21100802910;"Arterial Hypertension";journal;"24496170, 24496162";0,107;Q4;9;47;137;1517;10;137;0,09;32,28;Poland;Eastern Europe;"Via Medica";"2015-2020";"Cardiology and Cardiovascular Medicine (Q4); Endocrinology, Diabetes and Metabolism (Q4); Internal Medicine (Q4)"
1496;4700152300;"Brazilian Journal of Otorhinolaryngology";journal;"18088694, 18088686";0,107;Q4;33;72;4;1330;0;3;0,00;18,47;Brazil;Latin America;"Elsevier Editora Ltda";"2005-2020";"Otorhinolaryngology (Q4)"
1497;14049;"Iatreia";journal;"01210793";0,107;Q4;10;56;89;954;9;85;0,08;17,04;Colombia;Latin America;"Universidad de Antioquia";"1988-2020";"Medicine (miscellaneous) (Q4)"
1498;22917;"Journal of Empirical Generalisations in Marketing Science";journal;"13264443";0,107;Q4;11;3;3;220;0;3;0,00;73,33;Australia;Pacific Region;"University of South Australia";"1996-2003, 2005-2007, 2009-2010, 2013-2014, 2016-2019";"Marketing (Q4)"
1499;17226;"Journal of Medical Ultrasound";journal;"09296441, 22121552";0,107;Q4;14;16;59;275;2;56;0,02;17,19;Singapore;Asiatic Region;"Wolters Kluwer Medknow Publications";"1994-2020";"Radiology, Nuclear Medicine and Imaging (Q4)"
1500;5000160205;"Revista Cubana de Medicina General Integral";journal;"08642125";0,107;Q4;13;69;108;1104;5;108;0,05;16,00;Cuba;Latin America;"Editorial Ciencias Medicas";"1996-2002, 2004-2020";"Medicine (miscellaneous) (Q4)"
1501;21100395051;"Ukrainian Biochemical Journal";journal;"24094943, 24135003";0,107;Q4;15;96;579;2936;32;579;0,04;30,58;Ukraine;Eastern Europe;"Palladin Institute of Biochemistry of the National Academy of Sciences of Ukraine (NASU)";"2013-2020";"Biochemistry (Q4)"
1502;14211;"Archives of Psychiatry and Psychotherapy";journal;"2083828X, 15092046";0,106;Q4;11;23;76;748;3;70;0,04;32,52;Poland;Eastern Europe;"Polish Psychiatric Association";"2001-2020";"Clinical Psychology (Q4); Psychiatry and Mental Health (Q4)"
1503;21100780798;"International Journal of Engineering, Transactions B: Applications";journal;"1728144X, 17359244";0,106;Q3;17;10;73;192;5;73;0,07;19,20;Iran;Middle East;"Materials and Energy Research Center";"2004-2020";"Engineering (miscellaneous) (Q3)"
1504;16243;"Journal fur Neurologie, Neurochirurgie und Psychiatrie";journal;"16081587, 16809440";0,106;Q4;7;33;92;1048;8;77;0,07;31,76;Austria;Western Europe;"Krause und Pachernegg GmbH";"2002-2020";"Neurology (clinical) (Q4); Psychiatry and Mental Health (Q4); Surgery (Q4)"
1505;27018;"Journal of Energy in Southern Africa";trade journal;"1021447X";0,106;Q3;20;37;62;517;2;62;0,06;13,97;South Africa;Africa;"Energy Research Institute, University of Cape Town";"1993-2007, 2009-2020";"Energy (miscellaneous) (Q3); Computer Science (miscellaneous) (Q4)"
1506;6100153013;"Journal of the Egyptian National Cancer Institute";journal;"11100362";0,106;Q4;22;46;39;0;2;38;0,05;0,00;Egypt;Africa/Middle East;"National Cancer Institute";"2005-2009, 2011-2020";"Cancer Research (Q4); Oncology (Q4)"
1507;29420;"Metal Powder Report";journal;"18734065, 00260657";0,106;Q3;24;55;262;193;14;186;0,06;3,51;United Kingdom;Western Europe;"Elsevier Ltd.";"1983-2020";"Materials Science (miscellaneous) (Q3); Aerospace Engineering (Q4); Automotive Engineering (Q4); Mechanical Engineering (Q4); Mechanics of Materials (Q4)"
1508;14474;"Reinforced Plastics";trade journal;"00343617";0,106;Q3;25;123;510;7;12;187;0,02;0,06;Netherlands;Western Europe;"Elsevier BV";"1990-2020";"Polymers and Plastics (Q3)"
1509;300147002;"Tamkang Journal of Mathematics";journal;"00492930";0,106;Q4;18;40;41;452;1;41;0,02;11,30;Taiwan;Asiatic Region;"Tamkang University";"2005-2020";"Applied Mathematics (Q4); Materials Science (miscellaneous) (Q4); Mathematics (miscellaneous) (Q4); Metals and Alloys (Q4)"
1510;20158;"Alergia Astma Immunologia";journal;"14273101";0,105;Q4;10;35;95;1049;10;95;0,11;29,97;Poland;Eastern Europe;"University School of Medicine of Lodz";"2000-2020";"Immunology and Allergy (Q4); Pulmonary and Respiratory Medicine (Q4)"
1511;7500153130;"Annals of Gastroenterology";journal;"11087471";0,105;Q4;33;59;179;1850;5;135;0,03;31,36;Greece;Western Europe;"Hellenic Society of Gastroenterology";"2000-2020";"Gastroenterology (Q4)"
1512;21028;"Cirugia Plastica Ibero-Latinoamericana";journal;"03767892";0,105;Q4;10;59;107;611;2;62;0,02;10,36;Spain;Western Europe;"Sociedad Espanola de Cirugia Plastica Reparadora y Estetica (SECPRE)";"1975-2002, 2004-2020";"Surgery (Q4)"
1513;14952;"Clinical Pediatric Endocrinology";journal;"09185739, 13477358";0,105;Q4;16;24;68;562;2;67;0,00;23,42;Japan;Asiatic Region;"Jeff Corporation Co. Ltd";"1992-2020";"Endocrinology (Q4); Endocrinology, Diabetes and Metabolism (Q4); Pediatrics, Perinatology and Child Health (Q4)"
1514;21100200820;"Emirates Journal of Food and Agriculture";journal;"20790538, 2079052X";0,105;Q4;28;10;35;279;7;35;0,24;27,90;United Arab Emirates;Middle East;"United Arab Emirates University";"1996-2020";"Agronomy and Crop Science (Q4); Animal Science and Zoology (Q4); Applied Microbiology and Biotechnology (Q4); Food Science (Q4)"
1515;21100202940;"International Journal of Multicultural Education";journal;"19345267";0,105;Q3;16;16;33;398;1;31;0,04;24,88;United States;Northern America;"Eastern University, PhD in Organizational Leadership";"2007-2020";"Cultural Studies (Q3); Anthropology (Q4); Education (Q4); Social Sciences (miscellaneous) (Q4)"
1516;79567;"Journal of the Royal College of Physicians of Edinburgh, The";journal;"14782715";0,105;Q3;26;13;39;0;7;39;0,05;0,00;United Kingdom;Western Europe;"Royal College of Physicians of Edinburgh";"2002-2020";"History (Q3); Education (Q4); Medicine (miscellaneous) (Q4)"
1517;3200147836;"Norsk Epidemiologi";journal;"08032491";0,105;Q4;19;20;25;470;2;22;0,08;23,50;Norway;Western Europe;"Norwegian Epidemiological Society";"2005-2017, 2019";"Epidemiology (Q4)"
1518;57692;"Nutricion Clinica y Dietetica Hospitalaria";journal;"02116057";0,105;Q4;11;56;107;621;6;100;0,08;11,09;Spain;Western Europe;"Fundacion Alimentacion Saludable";"1981-1982, 2002-2019";"Medicine (miscellaneous) (Q4); Nutrition and Dietetics (Q4)"
1519;21823;"Pharmacia";journal;"04280296";0,105;Q4;9;21;98;320;5;98;0,06;15,24;Bulgaria;Eastern Europe;"Pensoft Publishers";"1945, 1954-1955, 1987-1991, 1997-2020";"Pharmaceutical Science (Q4); Pharmacology (medical) (Q4); Pharmacy (Q4)"
1520;12431;"Prace i Studia Geograficzne";journal;"02084589";0,105;Q4;10;0;49;0;5;49;0,03;0,00;Poland;Eastern Europe;"Warsaw University";"1979, 1983-1985, 1988, 1992, 1994-2005, 2008-2020";"Earth and Planetary Sciences (miscellaneous) (Q4); Geography, Planning and Development (Q4)"
1521;19356;"Schweizer Archiv fur Neurologie und Psychiatrie";journal;"02587661";0,105;Q4;0;0;0;0;0;0;0,00;0,00;Switzerland;Western Europe;"Schwabe und Co. AG";"1985-2015";"Neurology (clinical) (Q4); Psychiatry and Mental Health (Q4)"
1522;5700170927;"Atlantis";journal;"02106124";0,104;Q2;10;16;44;399;8;44;0,21;24,94;Spain;Western Europe;"Spanish Association of Anglo-American Studies";"2000-2019";"Literature and Literary Theory (Q2); Cultural Studies (Q3); Language and Linguistics (Q3); Linguistics and Language (Q3)"
1523;5800208127;"Catalan Journal of Linguistics";journal;"16956885";0,104;Q3;16;9;27;380;5;27;0,00;42,22;Spain;Western Europe;"Universitat Autonoma de Barcelona, Servei de Publicacions";"2002-2019";"Language and Linguistics (Q3); Linguistics and Language (Q3)"
1524;16300154799;"Estudos Ibero-Americanos";journal;"1980864X, 01014064";0,104;Q3;5;26;63;591;1;60;0,00;22,73;Brazil;Latin America;"Editora da P U C R S";"1994, 2002-2020";"History (Q3)"
1525;19700174704;"ITEA Informacion Tecnica Economica Agraria";journal;"16996887";0,104;Q4;10;0;30;0;3;30;0,10;0,00;Spain;Western Europe;"Asociacion Interprofesional para el Desarrollo Agrario";"2005, 2008-2020";"Agronomy and Crop Science (Q4); Horticulture (Q4); Veterinary (miscellaneous) (Q4)"
1526;4500151503;"Jornal Brasileiro de Pneumologia";journal;"18063713, 18063756";0,104;Q4;39;144;28;3571;1;28;0,04;24,80;Brazil;Latin America;"Sociedade Brasileira de Pneumologia e Tisiologia";"2004-2020";"Pulmonary and Respiratory Medicine (Q4)"
1527;19970;"Journal fur Urologie und Urogynakologie";journal;"10236090, 16809424";0,104;Q4;6;77;206;468;5;190;0,02;6,08;Austria;Western Europe;"Krause und Pachernegg GmbH";"1999-2020";"Obstetrics and Gynecology (Q4); Urology (Q4)"
1528;10300153342;"Journal of Medical Toxicology";journal;"15569039, 19376995";0,104;Q4;49;41;8;21;0;6;0,00;0,51;United States;Northern America;"Springer New York";"2005-2020";"Health, Toxicology and Mutagenesis (Q4); Toxicology (Q4)"
1529;4000148006;"Laeknabladid";journal;"16704959, 00237213";0,104;Q4;12;51;42;185;4;29;0,10;3,63;Iceland;Western Europe;"Icelandic Medical Association";"1945-1946, 1948, 1955-1964, 1973-1974, 1983, 2005-2020";"Medicine (miscellaneous) (Q4)"
1530;4500151538;"Revista Brasileira de Parasitologia Veterinaria";journal;"0103846X";0,104;Q4;31;40;30;0;2;30;0,07;0,00;Brazil;Latin America;"BRAZILIAN COLL VETERINARY PARASITOLOGY";"2005-2020";"Parasitology (Q4); Veterinary (miscellaneous) (Q4)"
1531;17951;"Vestnik Rentgenologii i Radiologii";journal;"00424676";0,104;Q4;6;55;162;399;1;162;0,00;7,25;Russian Federation;Eastern Europe;"Nauchnoe Obshchestvo Rentgenologov i Radiologov";"1946, 1953-2008, 2010-2016";"Mechanics of Materials (Q4); Medicine (miscellaneous) (Q4)"
1532;15242;"Xibei Gongye Daxue Xuebao/Journal of Northwestern Polytechnical University";journal;"10002758";0,104;Q4;17;178;361;1196;22;361;0,07;6,72;China;Asiatic Region;"Northwestern Polytechnical University";"1986-2020";"Engineering (miscellaneous) (Q4)"
1533;4000149602;"Acta of Bioengineering and Biomechanics";journal;"1509409X";0,103;Q4;25;37;8;449;0;8;0,00;12,14;Poland;Eastern Europe;"Institute of Machine Design and Operation";"2005-2020";"Bioengineering (Q4); Biomaterials (Q4); Biomedical Engineering (Q4); Biophysics (Q4)"
1534;17600155231;"Biopolymers and Cell";journal;"19936842, 02337657";0,103;Q4;15;55;195;1061;4;190;0,03;19,29;Ukraine;Eastern Europe;"National Academy of Sciences of Ukraine";"1996-2020";"Biochemistry, Genetics and Molecular Biology (miscellaneous) (Q4)"
1535;12616;"Dynamis";journal;"02119536";0,103;Q4;12;12;41;0;7;41;0,14;0,00;Spain;Western Europe;"Universidad de Granada";"1981-1985, 1987, 1989-2019";"History and Philosophy of Science (Q4); Medicine (miscellaneous) (Q4)"
1536;21100201540;"Economia Agraria y Recursos Naturales";journal;"15780732, 21747350";0,103;Q4;9;0;7;0;0;7;0,00;0,00;Spain;Western Europe;"Universitat Politecnica de Valencia";"2001, 2004, 2011-2020";"Agricultural and Biological Sciences (miscellaneous) (Q4); Environmental Science (miscellaneous) (Q4); Geography, Planning and Development (Q4)"
1537;13897;"Fossils";journal;"00229202";0,103;Q4;9;10;59;321;4;58;0,11;32,10;Japan;Asiatic Region;"Palaeontological Society of Japan";"1993-2020";"Paleontology (Q4)"
1538;19921;"Hong Kong Journal of Nephrology";journal;"18764371, 15615413";0,103;Q4;9;18;67;363;5;61;0,12;20,17;Singapore;Asiatic Region;"Elsevier (Singapore) Pte Ltd";"2002-2016";"Nephrology (Q4)"
1539;56074;"Human IT";journal;"14021501";0,103;Q4;10;8;21;144;4;18;0,19;18,00;Sweden;Western Europe;"Hoegskolan i Boraas";"1997-2002, 2004-2010, 2012, 2014-2019";"E-learning (Q4); Human-Computer Interaction (Q4); Information Systems (Q4)"
1540;15240;"Iranian Journal of Medical Sciences";journal;"17353688, 02530716";0,103;Q4;26;64;161;1120;23;145;0,10;17,50;Iran;Middle East;"Shiraz University of Medical Sciences";"1979-1981, 1989-2020";"Medicine (miscellaneous) (Q4)"
1541;130011;"Journal of Medical Sciences (Taiwan)";journal;"10114564";0,103;Q4;12;47;60;905;3;60;0,05;19,26;Taiwan;Asiatic Region;"Wolters Kluwer Medknow Publications";"1963, 2005-2020";"Medicine (miscellaneous) (Q4)"
1542;21100451688;"Lean Construction Journal";journal;"15551369";0,103;Q4;22;0;14;0;3;9;0,21;0,00;United States;Northern America;"Lean Construction Institute";"2004-2005, 2007-2019";"Building and Construction (Q4); Civil and Structural Engineering (Q4)"
1543;55176;"New Medicine";journal;"14270994";0,103;Q4;5;28;91;589;4;91;0,00;21,04;Poland;Eastern Europe;"Borgis Publishing House";"1999, 2001-2008, 2011-2018";"Medicine (miscellaneous) (Q4)"
1544;19600165500;"Politica y Gobierno";journal;"14051060, 16652037";0,103;Q4;13;10;8;382;0;8;0,00;38,20;Mexico;Latin America;"Centro de Investigacion y Docencia Economicas A.C.";"2000-2003, 2005-2020";"Political Science and International Relations (Q4)"
1545;5000157109;"Revista Cubana de Hematologia, Inmunologia y Hemoterapia";journal;"08640289, 15612996";0,103;Q4;8;30;15;953;1;15;0,00;31,77;Cuba;Latin America;"Editorial Ciencias Medicas";"1999-2003, 2006-2020";"Hematology (Q4); Immunology (Q4); Immunology and Allergy (Q4)"
