Rank;Sourceid;Title;Type;Issn;SJR;SJR Best Quartile;H index;Total Docs. (2009);Total Docs. (3years);Total Refs.;Total Cites (3years);Citable Docs. (3years);Cites / Doc. (2years);Ref. / Doc.;Country;Region;Publisher;Coverage;Categories
1623;21100255536;"Journal of Mathematical Physics, Analysis, Geometry";journal;"18175805, 18129471";0,166;Q4;11;21;28;300;8;28;0,29;14,29;Ukraine;Eastern Europe;"ILTPE-B. Verkin Institute for Low Temperature Physics and Engineering";"2008-2020";"Analysis (Q4); Geometry and Topology (Q4); Mathematical Physics (Q4)"
1624;15400155600;"Nuovo Cimento della Societa Italiana di Fisica C";journal;"20374909, 18269885";0,166;Q4;25;212;190;3269;54;185;0,24;15,42;Italy;Western Europe;"Editrice Compositori s.r.l.";"1978-2019";"Physics and Astronomy (miscellaneous) (Q4)"
1625;11700154379;"Open Medicine";journal;"19112092";0,166;Q3;29;21;19;766;10;11;0,53;36,48;Canada;Northern America;"Open Medicine";"2008-2019";"Medicine (miscellaneous) (Q3)"
1626;19700174916;"Thrapeutic Advances in Gastroenterology";journal;"1756283X, 17562848";0,166;Q3;51;31;18;1991;13;15;0,72;64,23;United Kingdom;Western Europe;"SAGE Publications Ltd";"2008-2020";"Gastroenterology (Q3)"
1627;25141;"Zeitschrift fur Kristallographie - New Crystal Structures";journal;"14337266";0,166;Q3;36;639;747;5440;218;747;0,27;8,51;Germany;Western Europe;"Walter de Gruyter GmbH";"1954, 1956-2020";"Materials Science (miscellaneous) (Q3); Condensed Matter Physics (Q4); Inorganic Chemistry (Q4)"
1628;21949;"Revista Brasileira de Anestesiologia";journal;"00347094, 1806907X";0,165;Q3;29;86;245;1824;91;207;0,31;21,21;Brazil;Latin America;"Elsevier Editora Ltda";"1960-1982, 1994-2020";"Anesthesiology and Pain Medicine (Q3)"
1629;19900192431;"Revista Mexicana de Ingeniera Qumica";journal;"16652738";0,165;Q3;18;31;35;823;13;35;0,37;26,55;Mexico;Latin America;"Universidad Autonoma Metropolitana-Iztapalapa";"2008-2020";"Chemical Engineering (miscellaneous) (Q3)"
1630;21100286450;"Bioscience Horizons";journal;"17547431";0,164;Q3;17;23;22;894;10;22;0,45;38,87;United Kingdom;Western Europe;"Oxford University Press";"2008-2019";"Agricultural and Biological Sciences (miscellaneous) (Q3); Biochemistry, Genetics and Molecular Biology (miscellaneous) (Q3)"
1631;32733;"Brodogradnja";journal;"18455859, 0007215X";0,164;Q3;14;16;66;171;10;54;0,21;10,69;Croatia;Eastern Europe;"Brodarski Institute";"1985-1988, 1994, 1996-2020";"Mechanical Engineering (Q3); Ocean Engineering (Q3)"
1632;4800153103;"Indian Journal of Radio and Space Physics";journal;"03678393";0,164;Q3;22;42;165;1080;30;165;0,18;25,71;India;Asiatic Region;"Council of Scientific and Industrial Research";"1996-2018";"Earth and Planetary Sciences (miscellaneous) (Q3); Physics and Astronomy (miscellaneous) (Q4)"
1633;145396;"Journal of Minimal Access Surgery";journal;"09729941";0,164;Q3;26;32;111;399;35;98;0,31;12,47;India;Asiatic Region;"Wolters Kluwer Medknow Publications";"2005-2020";"Surgery (Q3)"
1634;5800179590;"Pharmacologyonline";journal;"18278620";0,164;Q3;25;398;379;9952;144;379;0,38;25,01;Italy;Western Europe;"SILAE - Societa Italo-Latinoamericana di Etnomedicina";"2007-2020";"Pharmacology (Q3); Drug Discovery (Q4)"
1635;27796;"Romanian Journal of Legal Medicine";journal;"12218618";0,164;Q4;12;48;147;885;10;136;0,10;18,44;Romania;Eastern Europe;"Romanian Legal Medicine Society";"1995-2020";"Pathology and Forensic Medicine (Q4)"
1636;15900154750;"South African Journal of Economic and Management Sciences";journal;"22223436, 10158812";0,164;Q3;17;27;119;944;19;113;0,08;34,96;South Africa;Africa;"AOSIS (Pty) Ltd";"1999, 2001, 2006-2020";"Business, Management and Accounting (miscellaneous) (Q3); Economics, Econometrics and Finance (miscellaneous) (Q3)"
1637;5000154508;"Ciencia da Informacao";journal;"01001965";0,163;Q3;11;32;71;993;14;70;0,02;31,03;Brazil;Latin America;"Brazilian Institute for Information in Science and Technology";"2006-2013, 2015-2019";"Library and Information Sciences (Q3)"
1638;11700154615;"Hepatitis Monthly";journal;"17353408, 1735143X";0,163;Q3;37;52;89;1596;61;72;0,69;30,69;Netherlands;Western Europe;"Kowsar Publishing Company";"2007-2020";"Hepatology (Q3); Infectious Diseases (Q4)"
1639;11800154542;"International Journal of Computers, Communications and Control";journal;"18419836, 18419844";0,163;Q4;33;40;126;767;49;123;0,39;19,18;Romania;Eastern Europe;"CCC Publications, R &amp; D Agora";"2007-2020";"Computational Theory and Mathematics (Q4); Computer Networks and Communications (Q4); Computer Science Applications (Q4)"
1640;17700155407;"Journal of Infection in Developing Countries";journal;"20366590, 19722680";0,163;Q3;49;148;108;3734;39;99;0,36;25,23;Italy;Western Europe;"Journal of Infection in Developing Countries";"2007-2020";"Medicine (miscellaneous) (Q3); Infectious Diseases (Q4); Microbiology (Q4); Parasitology (Q4); Virology (Q4)"
1641;17300154721;"Journal of Physical Agents";journal;"18880258";0,163;Q3;14;23;18;431;13;18;0,72;18,74;Spain;Western Europe;"University of Alicante";"2007-2013, 2017";"Control and Systems Engineering (Q3); Software (Q4)"
1642;23730;"Suo";journal;"00395471";0,163;Q3;17;9;22;243;9;22;0,46;27,00;Finland;Western Europe;"Suoseura - Finnish Peatland Society";"1983, 1986, 1992-1994, 1996-2016, 2018-2019";"Water Science and Technology (Q3); Ecology (Q4); Geology (Q4); Soil Science (Q4)"
1643;22933;"Turkish Journal of Electrical Engineering and Computer Sciences";journal;"13000632, 13036203";0,163;Q3;30;27;82;415;44;80;0,63;15,37;Turkey;Middle East;"Turkiye Klinikleri Journal of Medical Sciences";"1996-2020";"Computer Science (miscellaneous) (Q3); Electrical and Electronic Engineering (Q3)"
1644;21100203110;"Computer Optics";journal;"01342452";0,162;Q3;29;57;63;1133;28;63;0,44;19,88;Russian Federation;Eastern Europe;"Institution of Russian Academy of Sciences, Image Processing Systems Institute of RAS";"2008-2020";"Electrical and Electronic Engineering (Q3); Atomic and Molecular Physics, and Optics (Q4); Computer Science Applications (Q4)"
1645;19700186703;"Croatian Journal of Philosophy";journal;"13331108, 18476139";0,162;Q2;9;15;20;439;11;12;0,55;29,27;Croatia;Eastern Europe;"Kruzak";"2008-2019";"Philosophy (Q2)"
1646;87828;"International Journal of Heat and Technology";journal;"03928764";0,162;Q3;29;44;123;748;42;122;0,44;17,00;Italy;Western Europe;"Edizioni E.T.S.";"1983-1993, 1995-2020";"Fluid Flow and Transfer Processes (Q3); Mechanical Engineering (Q3); Condensed Matter Physics (Q4)"
1647;144917;"Journal of Applied Mathematics";journal;"16870042, 1110757X";0,162;Q4;43;12;37;303;17;37;0,33;25,25;United States;Northern America;"Hindawi Publishing Corporation";"2001-2020";"Applied Mathematics (Q4)"
1648;21233;"Management";journal;"18463363, 13310194";0,162;Q3;15;10;23;272;7;23;0,30;27,20;Croatia;Eastern Europe;"University of Split - Faculty of Economics";"2007-2020";"Business, Management and Accounting (miscellaneous) (Q3); Strategy and Management (Q3)"
1649;145096;"Neuropsychopharmacologia Hungarica";journal;"14198711";0,162;Q2;16;23;82;757;21;72;0,16;32,91;Hungary;Eastern Europe;"Hungarian Association of Psychopharmacology";"2004-2020";"Pharmacology, Toxicology and Pharmaceutics (miscellaneous) (Q2); Neurology (clinical) (Q3); Neuropsychology and Physiological Psychology (Q4); Neuroscience (miscellaneous) (Q4)"
1650;16469;"Pakistan Journal of Medical Sciences";journal;"1682024X, 1681715X";0,162;Q3;30;217;564;4098;181;531;0,30;18,88;Pakistan;Asiatic Region;"Professional Medical Publications";"2000-2020";"Medicine (miscellaneous) (Q3)"
1651;145648;"Refuge";journal;"02295113";0,162;Q2;22;36;79;2479;25;73;0,20;68,86;Canada;Northern America;"York University";"2003-2020";"Cultural Studies (Q2); Demography (Q3)"
1652;19332;"Salud Mental";journal;"01853325";0,162;Q4;24;70;169;2259;62;163;0,29;32,27;Mexico;Latin America;"Elsevier GmbH";"1995-2020";"Clinical Psychology (Q4); Psychiatry and Mental Health (Q4)"
1653;27281;"Scandinavian Journal of Laboratory Animal Science";journal;"09013393, 20020112";0,162;Q3;19;37;71;1052;19;71;0,25;28,43;Denmark;Western Europe;"Scandinavian Society for Laboratory Animal Science";"1996-2012, 2014-2020";"Biochemistry, Genetics and Molecular Biology (miscellaneous) (Q3); Veterinary (miscellaneous) (Q3); Animal Science and Zoology (Q4)"
1654;13000154710;"Tropical Plant Pathology";journal;"19825676, 19832052";0,162;Q3;23;63;72;1550;17;71;0,24;24,60;Switzerland;Western Europe;"Springer International Publishing AG";"2008-2020";"Agronomy and Crop Science (Q3); Plant Science (Q4)"
1655;21100246535;"Lankesteriana";journal;"14093871, 22152067";0,161;Q4;13;0;101;0;21;98;0,21;0,00;Costa Rica;Latin America;"Universidad de Costa Rica";"2004-2007, 2013-2020";"Plant Science (Q4)"
1656;66304;"Revista de Geografia Norte Grande";journal;"03798682";0,161;Q3;18;19;42;606;10;40;0,19;31,89;Chile;Latin America;"Revista de Geografia Norte Grande";"1981, 1983, 2004-2020";"Earth-Surface Processes (Q3); Geography, Planning and Development (Q3)"
1657;20889;"Voprosy Virusologii";journal;"05074088";0,161;Q3;15;59;181;979;38;181;0,20;16,59;Russian Federation;Eastern Europe;"Izdatelstvo Meditsina";"1956-2020";"Medicine (miscellaneous) (Q3); Infectious Diseases (Q4); Virology (Q4)"
1658;28087;"Documents d' Analisi Geografica";journal;"20144512, 02121573";0,160;Q3;17;17;48;663;10;48;0,03;39,00;Spain;Western Europe;"Universitat Autonoma de Barcelona";"1988-2020";"Earth-Surface Processes (Q3); Geography, Planning and Development (Q3)"
1659;21100416607;"Enfermeria Nefrologica";journal;"22542884, 22553517";0,160;Q3;9;39;82;350;8;55;0,10;8,97;Spain;Western Europe;"Sociedad Espanola de Enfermeria Nefrologica";"2012-2020";"Advanced and Specialized Nursing (Q3); Nephrology (Q3); Nursing (miscellaneous) (Q3); Urology (Q3)"
1660;7700153112;"Index de Enfermeria";journal;"11321296";0,160;Q3;9;69;170;1105;17;137;0,09;16,01;Spain;Western Europe;"Fundacion Index";"2006-2019";"History and Philosophy of Science (Q3); Health (social science) (Q4); Public Health, Environmental and Occupational Health (Q4)"
1661;15238;"Iranian Biomedical Journal";journal;"2008823X, 1028852X";0,160;Q3;31;32;107;991;61;107;0,49;30,97;Iran;Middle East;"Pasteur Institute of Iran";"1999-2020";"Biochemistry, Genetics and Molecular Biology (miscellaneous) (Q3); Biochemistry (medical) (Q3); Clinical Biochemistry (Q4)"
1662;61695;"Journal of the South African Veterinary Association";journal;"10199128, 22249435";0,160;Q3;31;52;131;1369;40;127;0,27;26,33;South Africa;Africa;"AOSIS (Pty) Ltd";"1945, 1948, 1961, 1971-2020";"Medicine (miscellaneous) (Q3); Veterinary (miscellaneous) (Q3)"
1663;23317;"Polarforschung";journal;"00322490";0,160;Q3;24;39;32;986;9;31;0,22;25,28;Germany;Western Europe;"Deutsche Gesellschaft fur Polarforschung e.V.";"1978-1980, 1982, 1984-1985, 1988-1990, 1992-1997, 1999-2006, 2008-2014, 2016-2018";"Oceanography (Q3)"
1664;145267;"Rendiconti del Seminario Matematico";journal;"03731243";0,160;Q4;20;29;82;488;12;77;0,13;16,83;Italy;Western Europe;"Rendiconti del Seminario Matematico";"1999-2018";"Mathematics (miscellaneous) (Q4)"
1665;5000160208;"Revista Cubana de Educacion Medica Superior";journal;"08642141, 15612902";0,160;Q3;12;88;63;1017;12;61;0,15;11,56;Cuba;Latin America;"Editorial Ciencias Medicas";"1996-2002, 2006-2007, 2009-2020";"Medicine (miscellaneous) (Q3); Education (Q4)"
1666;20500195022;"Tecnologia y Ciencias del Agua";journal;"01878336, 20072422";0,160;Q3;12;44;131;952;20;131;0,16;21,64;Mexico;Latin America;"Instituto Mexicano de Tecnologia del Agua";"2010-2020";"Civil and Structural Engineering (Q3); Water Science and Technology (Q3)"
1667;23492;"Yugoslav Journal of Operations Research";journal;"03540243";0,160;Q4;21;24;60;396;9;60;0,17;16,50;Serbia;Eastern Europe;"University of Belgrade";"1994-1997, 1999-2020";"Management Science and Operations Research (Q4)"
1668;5800179608;"Acta Montanistica Slovaca";journal;"13351788";0,159;Q3;21;50;198;525;6;198;0,03;10,50;Slovakia;Eastern Europe;"Technical University of Kosice";"2007-2020";"Geotechnical Engineering and Engineering Geology (Q3); Geochemistry and Petrology (Q4); Geology (Q4)"
1669;19700183006;"International Journal of Agricultural and Biological Engineering";journal;"19346352, 19346344";0,159;Q3;31;40;23;1033;6;22;0,26;25,83;China;Asiatic Region;"Chinese Society of Agricultural Engineering";"2008-2020";"Agricultural and Biological Sciences (miscellaneous) (Q3); Engineering (miscellaneous) (Q3)"
1670;19300157032;"Medziagotyra";journal;"13921320";0,159;Q3;24;66;70;1229;24;70;0,34;18,62;Lithuania;Eastern Europe;"Kauno Technologijos Universitetas";"2008-2020";"Materials Science (miscellaneous) (Q3)"
1671;19192;"Natural Resources Journal";journal;"00280739";0,159;Q3;26;15;99;3791;32;86;0,26;252,73;United States;Northern America;"University of New Mexico";"1977-2019";"Environmental Science (miscellaneous) (Q3); Law (Q3)"
1672;5600153488;"Rural Society";journal;"10371656";0,159;Q4;23;39;73;1151;26;65;0,28;29,51;United Kingdom;Western Europe;"Taylor and Francis Ltd.";"1991-2020";"Tourism, Leisure and Hospitality Management (Q4)"
1673;19700175102;"Tropical Medicine and Health";journal;"13488945, 13494147";0,159;Q4;21;4;41;101;16;41;0,47;25,25;United Kingdom;Western Europe;"BioMed Central Ltd.";"2004-2020";"Infectious Diseases (Q4); Public Health, Environmental and Occupational Health (Q4)"
1674;29546;"Australian Journal of Educational and Developmental Psychology";journal;"14465442";0,158;Q4;21;5;26;202;8;26;0,29;40,40;Australia;Pacific Region;"University of Newcastle";"2001-2017";"Developmental and Educational Psychology (Q4); Education (Q4)"
1675;12000154402;"Blood Transfusion";journal;"17232007";0,158;Q3;47;64;106;1488;35;84;0,39;23,25;Italy;Western Europe;"SIMTI Servizi Srl";"2003-2020";"Medicine (miscellaneous) (Q3); Hematology (Q4); Immunology and Allergy (Q4)"
1676;4700152714;"Cadernos de Pesquisa";journal;"01001574";0,158;Q2;16;45;94;1203;20;91;0,22;26,73;Brazil;Latin America;"Fundacao Carlos Chagas";"1983, 2006-2020";"Cultural Studies (Q2); Gender Studies (Q3); Education (Q4)"
1677;21100780798;"International Journal of Engineering, Transactions B: Applications";journal;"1728144X, 17359244";0,158;Q3;17;40;78;812;16;78;0,21;20,30;Iran;Middle East;"Materials and Energy Research Center";"2004-2020";"Engineering (miscellaneous) (Q3)"
1678;18367;"Medicina";journal;"16699106, 00257680";0,158;Q3;32;126;393;2948;131;295;0,27;23,40;Argentina;Latin America;"Instituto de Investigaciones Medicas";"1945-2020";"Medicine (miscellaneous) (Q3)"
1679;22940;"Microbial Ecology in Health and Disease";journal;"16512235, 0891060X";0,158;Q4;39;32;77;1203;27;68;0,45;37,59;Sweden;Western Europe;"Co-Action Publishing";"1988-1996, 1998-2009";"Microbiology (Q4); Microbiology (medical) (Q4)"
1680;26703;"Polish Archives of Internal Medicine";journal;"00323772, 18979483";0,158;Q3;35;142;430;3751;213;366;0,69;26,42;Poland;Eastern Europe;"Medycyna Praktyczna";"1953-2020";"Internal Medicine (Q3)"
1681;24086;"Pteridines";journal;"21954720, 09334807";0,158;Q4;16;12;48;272;22;45;0,37;22,67;United Kingdom;Western Europe;"International Society of Pteridinology";"1989-2020";"Biochemistry (Q4); Clinical Biochemistry (Q4); Molecular Medicine (Q4)"
1682;19500157304;"Zemdirbyste";journal;"13923196, 23358947";0,158;Q4;20;64;100;1768;22;100;0,22;27,63;Lithuania;Eastern Europe;"Lithuanian Research Centre for Agriculture and Forestry; Vytautas Magnus University";"2008-2020";"Agronomy and Crop Science (Q4)"
1683;19200157114;"African Invertebrates";journal;"16815556";0,157;Q4;14;20;16;616;5;16;0,31;30,80;South Africa;Africa;"Pensoft Publishers";"2008-2020";"Animal Science and Zoology (Q4); Ecology, Evolution, Behavior and Systematics (Q4); Insect Science (Q4); Paleontology (Q4)"
1684;12100154839;"Applied Bionics and Biomechanics";journal;"11762322, 17542103";0,157;Q3;23;28;43;822;21;41;0,49;29,36;Egypt;Africa/Middle East;"Hindawi Limited";"2007-2020";"Medicine (miscellaneous) (Q3); Bioengineering (Q4); Biomedical Engineering (Q4); Biotechnology (Q4)"
1685;12200154703;"Archives of Environmental Protection";journal;"03248461, 20834772, 20834810";0,157;Q3;21;49;104;1188;29;102;0,28;24,24;Poland;Eastern Europe;"Polish Academy of Sciences";"2007-2020";"Environmental Science (miscellaneous) (Q3)"
1686;19700175230;"Drug Design, Development and Therapy";journal;"11778881";0,157;Q3;64;22;30;1112;11;27;0,37;50,55;New Zealand;Pacific Region;"Dove Medical Press Ltd.";"2007-2020";"Pharmaceutical Science (Q3); Drug Discovery (Q4); Pharmacology (Q4)"
1687;26804;"Espace-Populations-Societes";journal;"07557809";0,157;Q3;12;36;87;912;9;84;0,14;25,33;France;Western Europe;"Universite des Sciences et Technologiques de Lille";"1983-2019";"Demography (Q3); Geography, Planning and Development (Q3)"
1688;21100201997;"Journal of Information Display";journal;"15980316, 21581606";0,157;Q3;22;38;80;509;18;80;0,28;13,39;United Kingdom;Western Europe;"Taylor and Francis Ltd.";"2000-2020";"Electrical and Electronic Engineering (Q3); Materials Science (miscellaneous) (Q3)"
1689;7400153105;"Journal of Mathematics and Statistics (discontinued)";journal;"15493644";0,157;Q4;20;52;103;688;23;103;0,22;13,23;United States;Northern America;"Science Publications";"2007-2016";"Mathematics (miscellaneous) (Q4); Statistics and Probability (Q4)"
1690;16555;"Phyton";journal;"00319457";0,157;Q4;17;26;57;668;9;57;0,14;25,69;Argentina;Latin America;"Fundacion Romulo Raggio";"1984, 1996-2000, 2006-2020";"Biochemistry (Q4); Physiology (Q4); Plant Science (Q4)"
1691;5800179589;"Plant Protection Science";journal;"12122580";0,157;Q4;21;31;51;863;18;51;0,35;27,84;Czech Republic;Eastern Europe;"Czech Academy of Agricultural Sciences";"2007-2020";"Agronomy and Crop Science (Q4); Soil Science (Q4)"
1692;20605;"Revista Portuguesa de Cardiologia";journal;"08702551, 21742030";0,157;Q3;26;128;340;2978;95;276;0,30;23,27;Portugal;Western Europe;"Sociedade Portuguesa De Cardiologia";"1970, 1982-2020";"Cardiology and Cardiovascular Medicine (Q3)"
1693;12300154711;"Archives of Biological Sciences";journal;"03544664";0,156;Q3;25;109;94;3039;28;93;0,30;27,88;Serbia;Eastern Europe;"Institut za Bioloska Istrazivanja";"2008-2020";"Agricultural and Biological Sciences (miscellaneous) (Q3); Biochemistry, Genetics and Molecular Biology (miscellaneous) (Q3)"
1694;28154;"Fennia";journal;"00150010";0,156;Q3;20;10;30;473;17;27;0,71;47,30;Finland;Western Europe;"Geographical Society of Finland";"1976, 1979-2009, 2011-2019";"Forestry (Q3); Geography, Planning and Development (Q3); Ecology (Q4)"
1695;21100301604;"Pediatric Dental Journal";journal;"18803997, 09172394";0,156;Q3;10;40;59;850;11;59;0,07;21,25;Netherlands;Western Europe;"Elsevier BV";"1997, 2004-2020";"Pediatrics, Perinatology and Child Health (Q3); Dentistry (miscellaneous) (Q4)"
1696;5200152619;"Revista de Sociologia e Politica";journal;"01044478";0,156;Q3;13;38;91;1167;7;83;0,09;30,71;Brazil;Latin America;"Universidade Federal do Parana";"2006-2020";"Sociology and Political Science (Q3)"
1697;100237;"Tekstilec";trade journal;"03513386";0,156;Q3;11;39;101;382;8;86;0,10;9,79;Slovenia;Eastern Europe;"Faculty of Natural Sciences and Engineering, Tekstilec";"1989-2020";"Business and International Management (Q3); Business, Management and Accounting (miscellaneous) (Q3); Industrial and Manufacturing Engineering (Q3); Polymers and Plastics (Q3)"
1698;14502;"Archives of Civil Engineering";journal;"12302945";0,155;Q3;15;28;116;540;24;113;0,19;19,29;Poland;Eastern Europe;"De Gruyter Open Ltd.";"1996-2020";"Civil and Structural Engineering (Q3)"
1699;73135;"Ciencia del Suelo";journal;"03263169";0,155;Q4;18;27;54;874;11;54;0,16;32,37;Argentina;Latin America;"Asociacion Argentina de la Ciencia del Suelo";"1994-2020";"Soil Science (Q4)"
1700;5900153309;"Journal of Muslim Mental Health";journal;"15564908, 15565009";0,155;Q2;19;13;23;417;17;19;0,74;32,08;United States;Northern America;"Michigan Publishing";"2007-2019";"Religious Studies (Q2); Health (social science) (Q4); Psychiatry and Mental Health (Q4)"
1701;17700156420;"Notulae Botanicae Horti Agrobotanici Cluj-Napoca";journal;"0255965X, 18424309";0,155;Q4;32;96;1;2207;1;1;1,00;22,99;Romania;Eastern Europe;"Academic Press Inc.";"2007, 2009-2020";"Agronomy and Crop Science (Q4); Horticulture (Q4); Plant Science (Q4)"
1702;25356;"Revista de gastroenterologia del Peru : organo oficial de la Sociedad de Gastroenterologia del Peru";journal;"1609722X, 10225129";0,155;Q3;15;52;142;471;35;129;0,28;9,06;Peru;Latin America;"Sociedad de Gastroenterologia del Peru";"1989-1996, 2001-2020";"Medicine (miscellaneous) (Q3)"
1703;16552;"School Library Media Research";journal;"15234320";0,155;Q2;12;6;19;289;5;18;0,23;48,17;United States;Northern America;"American Library Association";"2000-2014";"Media Technology (Q2); Library and Information Sciences (Q3)"
1704;23754;"Indian Heart Journal";journal;"00194832";0,154;Q3;37;104;389;1711;75;331;0,17;16,45;India;Asiatic Region;"Cardiology Society of India";"1961, 1964-2020";"Cardiology and Cardiovascular Medicine (Q3)"
1705;21100222547;"Latin American Journal of Economics";journal;"07190425, 07190433";0,154;Q3;8;0;0;0;0;0;0,00;0,00;Chile;Latin America;"Pontificia Universidad Catolica de Chile";"2011-2016";"Economics, Econometrics and Finance (miscellaneous) (Q3)"
1706;17900156728;"Polish Journal of Chemical Technology";journal;"18994741, 15098117";0,154;Q3;20;44;149;842;31;149;0,21;19,14;Poland;Eastern Europe;"De Gruyter Open Ltd.";"2007-2020";"Chemical Engineering (miscellaneous) (Q3); Biotechnology (Q4); Chemistry (miscellaneous) (Q4)"
1707;17698;"Puerto Rico Health Sciences Journal";journal;"07380658";0,154;Q3;25;46;150;1325;66;146;0,42;28,80;Puerto Rico;Latin America;"University of Puerto Rico Medical Sciences Campus";"1985-2020";"Medicine (miscellaneous) (Q3)"
1708;19400157235;"Revista Colombiana de Ciencias Pecuarias";journal;"22562958, 01200690";0,154;Q3;14;40;47;1046;6;42;0,13;26,15;Colombia;Latin America;"Universidad de Antioquia";"2008-2020";"Veterinary (miscellaneous) (Q3); Animal Science and Zoology (Q4)"
1709;19700182133;"South African Journal of Education";journal;"20763433, 02560100";0,154;Q4;27;32;37;1311;7;36;0,19;40,97;South Africa;Africa;"Foundation for Education Science and Technology";"2003, 2008-2020";"Education (Q4)"
1710;28537;"Annals of Long-Term Care";journal;"15247929";0,153;Q3;17;54;213;906;40;177;0,13;16,78;United States;Northern America;"HMP Communications LLP";"1998-2018";"Geriatrics and Gerontology (Q3); Gerontology (Q3)"
1711;12300154701;"Baltic Forestry";journal;"20299230, 13921355";0,153;Q3;17;32;28;1111;8;28;0,29;34,72;Lithuania;Eastern Europe;"Lietuvos Misku Institutas";"2008-2020";"Forestry (Q3)"
1712;5700165213;"Czech Journal of Genetics and Plant Breeding";journal;"12121975, 18059325";0,153;Q4;18;22;47;694;17;46;0,36;31,55;Czech Republic;Eastern Europe;"Czech Academy of Agricultural Sciences";"2007-2020";"Genetics (Q4); Plant Science (Q4)"
1713;56455;"Hrvatski Geografski Glasnik";journal;"13315854";0,153;Q3;9;10;28;244;1;28;0,05;24,40;Croatia;Eastern Europe;"Croatian Geographical Society";"1998-2001, 2003-2020";"Earth-Surface Processes (Q3); Geography, Planning and Development (Q3)"
1714;29812;"Indian Journal of Engineering and Materials Sciences";journal;"09714588";0,153;Q3;31;67;206;1248;42;205;0,20;18,63;India;Asiatic Region;"National Institute of Science Communication and Information Resources (NISCAIR)";"1994-2020";"Engineering (miscellaneous) (Q3); Materials Science (miscellaneous) (Q3)"
1715;21100202140;"Italian Journal of Linguistics";journal;"11202726";0,153;Q2;23;13;35;543;25;33;0,68;41,77;Italy;Western Europe;"Pacini Editore SpA";"1996-2013, 2015-2019";"Language and Linguistics (Q2); Linguistics and Language (Q2)"
1716;144786;"Journal of Japan Industrial Management Association";journal;"13422618, 21879079";0,153;Q3;8;34;159;526;12;156;0,07;15,47;Japan;Asiatic Region;"Nihon Keikei Kogakkai";"2004-2020";"Industrial and Manufacturing Engineering (Q3); Strategy and Management (Q3); Applied Mathematics (Q4); Management Science and Operations Research (Q4)"
1717;12100154808;"Journal of Korean Neurosurgical Society";journal;"12258245, 15987876, 20053711";0,153;Q3;34;187;107;4217;44;107;0,41;22,55;South Korea;Asiatic Region;"Daehan sin'gyeong oe'gwa haghoe";"2008-2020";"Neurology (clinical) (Q3); Surgery (Q3); Neuroscience (miscellaneous) (Q4)"
1718;20156;"Revista Alergia Mexico";journal;"00025151";0,153;Q4;15;61;103;917;37;91;0,25;15,03;Mexico;Latin America;"Nieto Editores";"1961, 1964-2020";"Immunology and Allergy (Q4)"
1719;3500148007;"Revista Chilena de Infectologia";journal;"07161018";0,153;Q4;19;98;259;1926;81;204;0,31;19,65;Chile;Latin America;"Sociedad Chilena de Infectologia";"2000-2020";"Infectious Diseases (Q4); Public Health, Environmental and Occupational Health (Q4)"
1720;6400153122;"American Journal of Applied Sciences (discontinued)";journal;"15469239, 15543641";0,152;Q3;45;299;435;5859;225;435;0,52;19,60;United States;Northern America;"Science Publications";"2007-2016";"Multidisciplinary (Q3)"
1721;57242;"Idojaras";journal;"03246329";0,152;Q4;16;27;9;768;6;9;0,67;28,44;Hungary;Eastern Europe;"Hungarian Meteorological Service";"1980, 2008-2020";"Atmospheric Science (Q4)"
1722;15234;"Investigacion Clinica";journal;"05355133";0,152;Q3;21;48;135;1900;62;129;0,37;39,58;Venezuela;Latin America;"";"1961, 1972-1986, 1988-2020";"Medicine (miscellaneous) (Q3)"
1723;18282;"Irish Veterinary Journal";journal;"03680762, 20460481";0,152;Q4;29;131;341;1069;39;281;0,10;8,16;United Kingdom;Western Europe;"BioMed Central Ltd.";"1973-1979, 1996-2020";"Veterinary (miscellaneous) (Q4)"
1724;58917;"Journal of Ayub Medical College, Abbottabad : JAMC";journal;"10259589";0,152;Q3;31;184;353;14;131;338;0,31;0,08;Pakistan;Asiatic Region;"Ayub Medical College";"2001-2020";"Medicine (miscellaneous) (Q3)"
