Rank;Sourceid;Title;Type;Issn;SJR;SJR Best Quartile;H index;Total Docs. (2006);Total Docs. (3years);Total Refs.;Total Cites (3years);Citable Docs. (3years);Cites / Doc. (2years);Ref. / Doc.;Country;Region;Publisher;Coverage;Categories
1025;21100795043;"Journal of Natural Remedies";journal;"23203358, 09725547";0,175;Q3;19;31;98;636;18;98;0,19;20,52;India;Asiatic Region;"Informatics Publishing Limited";"2002-2020";"Pharmacology (Q3)"
1026;14303;"Otolaryngologia Polska";journal;"23008423, 00306657";0,175;Q3;15;161;485;2813;99;484;0,21;17,47;Poland;Eastern Europe;"Index Copernicus International";"1954-2020";"Otorhinolaryngology (Q3)"
1027;14671;"Indian Journal of Medical Sciences (discontinued)";journal;"19983654, 00195359";0,174;Q3;41;111;314;1320;123;246;0,36;11,89;India;Asiatic Region;"Wolters Kluwer Medknow Publications";"1957-2013, 2016-2017";"Medicine (miscellaneous) (Q3)"
1028;15234;"Investigacion Clinica";journal;"05355133";0,174;Q3;21;38;99;1274;51;95;0,40;33,53;Venezuela;Latin America;"";"1961, 1972-1986, 1988-2020";"Medicine (miscellaneous) (Q3)"
1029;22205;"Saudi Pharmaceutical Journal";journal;"13190164";0,174;Q3;49;28;72;739;25;70;0,43;26,39;Saudi Arabia;Middle East;"King Saud University";"1996-2020";"Pharmaceutical Science (Q3); Pharmacology (Q3)"
1030;23730;"Suo";journal;"00395471";0,174;Q3;17;9;25;296;9;25;0,35;32,89;Finland;Western Europe;"Suoseura - Finnish Peatland Society";"1983, 1986, 1992-1994, 1996-2016, 2018-2019";"Ecology (Q3); Geology (Q3); Water Science and Technology (Q3); Soil Science (Q4)"
1031;19405;"Acta Poloniae Pharmaceutica";journal;"00016837";0,173;Q3;42;102;267;1470;82;267;0,26;14,41;Poland;Eastern Europe;"Polish Pharmaceutical Society";"1951-1955, 1961-2020";"Pharmaceutical Science (Q3); Pharmacology (Q3)"
1032;17660;"Archivos de Medicina Veterinaria";journal;"0301732X, 07176201";0,173;Q4;0;0;0;0;0;0;0,00;0,00;Chile;Latin America;"Universidad Austral de Chile";"1996-2016";"Veterinary (miscellaneous) (Q4)"
1033;28247;"Arquivos de Gastroenterologia";journal;"16784219, 00042803";0,173;Q3;30;65;153;1742;80;140;0,49;26,80;Brazil;Latin America;"IBEPEGE - Inst. Bras. Estudos Pesquisas Gastroent.";"1973-2020";"Gastroenterology (Q3)"
1034;21100305250;"Indian Journal of Geo-Marine Sciences";journal;"09751033";0,173;Q3;36;42;143;1189;32;143;0,26;28,31;India;Asiatic Region;"National Institute of Science Communication and Information Resources (NISCAIR)";"2007-2020";"Oceanography (Q3)"
1035;22595;"Revista de Salud Publica";journal;"01240064";0,173;Q3;23;52;62;1249;34;62;0,56;24,02;Colombia;Latin America;"Universidad Nacional de Colombia";"2003-2020";"Public Health, Environmental and Occupational Health (Q3)"
1036;18865;"Revue de Medecine Veterinaire";journal;"00351555";0,173;Q4;33;96;280;2809;61;280;0,20;29,26;France;Western Europe;"Ecole Nationale Veterinaire";"1949, 1961, 1973-1989, 1996-2019";"Veterinary (miscellaneous) (Q4)"
1037;19388;"Archivio Italiano di Urologia Andrologia";journal;"11243562, 22824197";0,172;Q3;23;51;181;629;55;175;0,30;12,33;Italy;Western Europe;"PagePress Publications";"1993-2020";"Urology (Q3)"
1038;18412;"Biomedical Reviews (discontinued)";journal;"1310392X, 13141929";0,172;Q3;13;0;24;0;12;23;0,67;0,00;Bulgaria;Eastern Europe;"Bulgarian-American Center";"1995-2005, 2007-2017";"Biochemistry, Genetics and Molecular Biology (miscellaneous) (Q3); Medicine (miscellaneous) (Q3)"
1039;13643;"BMC Ear, Nose and Throat Disorders";journal;"14726815";0,172;Q3;23;15;16;283;15;16;0,87;18,87;United Kingdom;Western Europe;"BioMed Central Ltd.";"2001-2019";"Otorhinolaryngology (Q3)"
1040;130118;"Canadian Journal of Infectious Diseases and Medical Microbiology";journal;"17129532, 19181493";0,172;Q3;38;50;159;1397;33;123;0,17;27,94;Egypt;Africa/Middle East;"Hindawi Limited";"2005-2020";"Microbiology (medical) (Q3); Infectious Diseases (Q4)"
1041;19806;"Chinese Journal of Mechanical Engineering (English Edition)";journal;"21928258, 10009345";0,172;Q2;33;137;462;1398;96;462;0,20;10,20;China;Asiatic Region;"Chinese Mechanical Engineering Society";"1990, 1998-2020";"Industrial and Manufacturing Engineering (Q2); Mechanical Engineering (Q3)"
1042;18302;"Journal of Swine Health and Production";journal;"1537209X";0,172;Q4;35;48;179;673;34;137;0,22;14,02;United States;Northern America;"American Association of Swine Veterinarians";"1996-2020";"Animal Science and Zoology (Q4); Food Animals (Q4)"
1043;17110;"Postepy Higieny i Medycyny Doswiadczalnej";journal;"17322693, 00325449";0,172;Q3;34;77;86;5903;50;86;0,75;76,66;Poland;Eastern Europe;"Index Copernicus International";"1949-2020";"Medicine (miscellaneous) (Q3); Microbiology (medical) (Q3); Infectious Diseases (Q4)"
1044;12603;"Revue de Geographie Alpine";journal;"00351121";0,172;Q3;15;22;79;257;10;75;0,10;11,68;France;Western Europe;"Armand Colin Editeur";"1977, 1979, 1982-1988, 1994-2020";"Earth-Surface Processes (Q3); Geography, Planning and Development (Q3)"
1045;92266;"Scientific Drilling";journal;"18163459, 18168957";0,172;Q2;24;17;28;108;7;27;0,32;6,35;United States;Northern America;"IODP-MI";"2005-2020";"Energy Engineering and Power Technology (Q2); Mechanical Engineering (Q3)"
1046;24078;"Acarologia";journal;"0044586X, 21077207";0,171;Q4;23;13;87;397;30;87;0,27;30,54;France;Western Europe;"Les Amis d'Acarologia";"1965-1985, 1987, 1994-2008, 2010-2020";"Insect Science (Q4)"
1047;23492;"Yugoslav Journal of Operations Research";journal;"03540243";0,171;Q4;21;19;58;354;9;58;0,18;18,63;Serbia;Eastern Europe;"University of Belgrade";"1994-1997, 1999-2020";"Management Science and Operations Research (Q4)"
1048;22589;"Estudios Geologicos";journal;"19883250, 03670449";0,170;Q3;27;43;56;2005;16;55;0,09;46,63;Spain;Western Europe;"CSIC Consejo Superior de Investigaciones Cientificas";"1976-1977, 1980-1983, 1991-2019";"Geology (Q3)"
1049;19600157018;"Journal of Research Practice";journal;"1712851X";0,170;Q3;22;15;18;385;20;16;1,11;25,67;United States;Northern America;"International Consortium for the Advancement of Academic Publishing";"2005-2018";"Education (Q3)"
1050;15159;"Review of Regional Studies";journal;"0048749X, 15530892";0,170;Q3;20;20;56;685;12;55;0,11;34,25;United States;Northern America;"Oklahoma State University";"1977-1982, 1984, 1987-2020";"Earth-Surface Processes (Q3); Geography, Planning and Development (Q3)"
1051;16360;"Tidsskrift for den Norske Laegeforening";journal;"00292001, 08077096";0,170;Q3;29;706;2104;6369;441;1346;0,22;9,02;Norway;Western Europe;"Norwegian Medical Association";"1946-2020";"Medicine (miscellaneous) (Q3)"
1052;33067;"Arquivos Brasileiros de Cardiologia";journal;"0066782X";0,169;Q3;53;255;577;7463;255;534;0,36;29,27;Brazil;Latin America;"Arquivos Brasileiros de Cardiologia";"1950-2020";"Cardiology and Cardiovascular Medicine (Q3)"
1053;21100823214;"Canadian Geriatrics Journal";journal;"19258348";0,169;Q3;21;30;65;711;12;55;0,21;23,70;Canada;Northern America;"Canadian Geriatrics Society";"2011-2020";"Geriatrics and Gerontology (Q3); Gerontology (Q3)"
1054;144938;"Diagnostic and Interventional Radiology";journal;"13053825, 13053612";0,169;Q3;43;48;224;860;76;210;0,45;17,92;Turkey;Middle East;"Turkish Society of Radiology";"2005-2020";"Cardiology and Cardiovascular Medicine (Q3); Radiology, Nuclear Medicine and Imaging (Q3)"
1055;25507;"Informatica (Slovenia)";journal;"18543871, 03505596";0,169;Q4;34;52;163;1404;72;158;0,53;27,00;Slovenia;Eastern Europe;"Slovene Society Informatika";"1995-2020";"Artificial Intelligence (Q4); Computer Science Applications (Q4); Software (Q4); Theoretical Computer Science (Q4)"
1056;145018;"Journal of Environmental Hydrology (discontinued)";journal;"10583912";0,169;Q3;15;27;31;535;7;31;0,23;19,81;United States;Northern America;"International Association for Environmental Hydrology";"1996-2002, 2005-2017";"Water Science and Technology (Q3)"
1057;21100312401;"Revista Cubana de Informacion en Ciencias de la Salud";journal;"23072113";0,169;Q3;11;100;198;1566;22;161;0,12;15,66;Cuba;Latin America;"Centro Nacional De Informacion De Ciencias Medicas";"2013-2020";"Health Policy (Q3); Library and Information Sciences (Q3); Health Information Management (Q4)"
1058;50094;"Archives of Electrical Engineering";journal;"14274221, 23002506";0,168;Q3;16;22;62;334;8;61;0,13;15,18;Poland;Eastern Europe;"Polish Academy of Sciences";"2004-2020";"Electrical and Electronic Engineering (Q3)"
1059;25257;"Balkan Journal of Geometry and its Applications";journal;"12242780, 18432875";0,168;Q4;18;32;82;368;12;81;0,14;11,50;Romania;Eastern Europe;"Balkan Society of Geometers";"2002-2019";"Geometry and Topology (Q4)"
1060;21009;"Mitteilungen aus dem Museum fur Naturkunde in Berlin - Deutsche Entomologische Zeitschrift";journal;"14351951, 18601324";0,168;Q4;17;25;58;584;23;56;0,32;23,36;Germany;Western Europe;"Pensoft Publishers";"1954-1955, 1957, 1959-1963, 1965-1974, 1976-1995, 1998-2020";"Insect Science (Q4)"
1061;13375;"Psicologica";journal;"02112159, 15768597";0,168;Q3;19;14;36;654;13;36;0,36;46,71;Spain;Western Europe;"Universitat de Valencia";"2004-2018";"Arts and Humanities (miscellaneous) (Q3); Developmental and Educational Psychology (Q4); Experimental and Cognitive Psychology (Q4); Psychology (miscellaneous) (Q4); Statistics and Probability (Q4)"
1062;22758;"Wildfowl";journal;"09546324";0,168;Q3;21;14;29;370;8;27;0,00;26,43;United Kingdom;Western Europe;"Wildfowl and Wetlands Trust";"1981-1982, 1987, 1990-2003, 2005-2018";"Ecology (Q3); Ecology, Evolution, Behavior and Systematics (Q4); Nature and Landscape Conservation (Q4)"
1063;14578;"Ecologia Austral";journal;"03275477, 1667782X";0,167;Q4;30;19;59;725;14;58;0,26;38,16;Argentina;Latin America;"Asociacion Argentina de Ecologia";"1991, 1993-2020";"Ecology (Q4); Ecology, Evolution, Behavior and Systematics (Q4)"
1064;12916;"E-Polymers";journal;"16187229";0,167;Q2;23;84;236;2267;66;235;0,28;26,99;France;Western Europe;"European Polymer Federation";"2001-2020";"Chemical Engineering (miscellaneous) (Q2); Polymers and Plastics (Q3); Physical and Theoretical Chemistry (Q4)"
1065;57103;"Korean Journal of Medical Mycology";journal;"12264709";0,167;Q4;9;23;63;444;9;63;0,10;19,30;South Korea;Asiatic Region;"Korean Society for Medical Mycology";"2002-2019";"Infectious Diseases (Q4)"
1066;19274;"Revista de Psiquiatria Clinica";journal;"1806938X, 01016083";0,167;Q4;25;50;139;2362;31;118;0,25;47,24;Brazil;Latin America;"Lemos Editorial e Graficos Ltda";"2000-2020";"Psychiatry and Mental Health (Q4)"
1067;29758;"Revista Mexicana de Fisica";journal;"0035001X";0,167;Q3;25;150;488;2933;134;486;0,24;19,55;Mexico;Latin America;"Sociedad Mexicana de Fisica";"1991-1993, 1995-2020";"Education (Q3); Physics and Astronomy (miscellaneous) (Q4)"
1068;20244;"Ulster Medical Journal";journal;"00416193";0,167;Q3;29;51;93;772;36;78;0,51;15,14;United Kingdom;Western Europe;"Ulster Medical Society";"1946-1947, 1950-2020";"Medicine (miscellaneous) (Q3)"
1069;4800152405;"Acta Ichthyologica et Piscatoria";journal;"01371592, 17341515";0,166;Q4;24;21;53;543;11;53;0,28;25,86;Poland;Eastern Europe;"Scientific Society of Szczecin";"1996-2020";"Aquatic Science (Q4)"
1070;130083;"Reproductive Medicine and Biology";journal;"14455781";0,166;Q3;22;37;69;1311;19;69;0,28;35,43;Japan;Asiatic Region;"John Wiley and Sons Inc.";"2004-2014, 2017-2020";"Reproductive Medicine (Q3); Cell Biology (Q4)"
1071;20856;"West Indian Medical Journal";journal;"00433144";0,166;Q3;31;105;295;2062;92;242;0,32;19,64;Jamaica;Latin America;"University of the West Indies";"1954-2019";"Medicine (miscellaneous) (Q3)"
1072;19736;"Indian Journal of Pathology and Microbiology";journal;"03774929, 09745130";0,165;Q3;31;179;550;2034;133;504;0,13;11,36;India;Asiatic Region;"Wolters Kluwer Medknow Publications";"1972, 1974-2020";"Medicine (miscellaneous) (Q3); Microbiology (medical) (Q3); Pathology and Forensic Medicine (Q4)"
1073;22362;"Infezioni in Medicina";journal;"11249390";0,165;Q4;22;33;118;822;37;111;0,31;24,91;Italy;Western Europe;"";"1997-2020";"Infectious Diseases (Q4); Microbiology (medical) (Q4)"
1074;17327;"Nuclear Medicine Review";journal;"16444345, 15069680";0,165;Q3;21;32;100;648;39;93;0,36;20,25;Poland;Eastern Europe;"Via Medica";"2002-2020";"Medicine (miscellaneous) (Q3); Radiology, Nuclear Medicine and Imaging (Q3)"
1075;20156;"Revista Alergia Mexico";journal;"00025151";0,165;Q4;15;36;124;608;22;112;0,16;16,89;Mexico;Latin America;"Nieto Editores";"1961, 1964-2020";"Immunology and Allergy (Q4)"
1076;144989;"International Journal of Environmental Research and Public Health";journal;"16617827, 16604601";0,164;Q3;113;46;76;1362;27;76;0,36;29,61;Switzerland;Western Europe;"MDPI Multidisciplinary Digital Publishing Institute";"2004-2020";"Public Health, Environmental and Occupational Health (Q3); Health, Toxicology and Mutagenesis (Q4)"
1077;22134;"Ornis Svecica";journal;"11026812";0,164;Q4;14;22;62;545;11;62;0,20;24,77;Sweden;Western Europe;"University of Lund";"1991-2020";"Animal Science and Zoology (Q4)"
1078;22367;"Progress in Natural Science: Materials International";journal;"10020071";0,164;Q2;63;186;468;4300;221;468;0,45;23,12;Netherlands;Western Europe;"Elsevier BV";"1996-2020";"Multidisciplinary (Q2); Materials Science (miscellaneous) (Q3)"
1079;26700;"Revista Argentina de Endocrinologia y Metabolismo (discontinued)";journal;"18513034, 03264610";0,164;Q3;11;27;56;783;38;50;0,60;29,00;Argentina;Latin America;"Sociedad Argentina de Endocrinologia y Metabolismo";"1957-1960, 1964, 1999-2017";"Endocrinology, Diabetes and Metabolism (Q3); Endocrinology (Q4)"
1080;20605;"Revista Portuguesa de Cardiologia";journal;"08702551, 21742030";0,164;Q3;26;97;406;2128;114;349;0,27;21,94;Portugal;Western Europe;"Sociedade Portuguesa De Cardiologia";"1970, 1982-2020";"Cardiology and Cardiovascular Medicine (Q3)"
1081;28578;"Przeglad Geofizyczny";journal;"00332135";0,163;Q4;10;16;41;337;7;40;0,18;21,06;Poland;Eastern Europe;"Przeglad Geofizyczny";"1986, 1993-2018";"Atmospheric Science (Q4)"
1082;34696;"Turk Tarim ve Ormancilik Dergisi/Turkish Journal of Agriculture and Forestry";journal;"1300011X, 13036173";0,163;Q3;43;49;164;1153;66;163;0,32;23,53;Turkey;Middle East;"Turkiye Klinikleri Journal of Medical Sciences";"1994-2020";"Forestry (Q3); Ecology (Q4); Food Science (Q4)"
1083;21100849723;"BJA Education";journal;"20585357, 20585349";0,162;Q3;37;50;118;424;28;113;0,26;8,48;United Kingdom;Western Europe;"Elsevier Ltd.";"2015-2020";"Anesthesiology and Pain Medicine (Q3)"
1084;26787;"Boletin de Investigaciones Marinas y Costeras";journal;"01229761";0,162;Q3;14;19;47;496;6;47;0,06;26,11;Colombia;Latin America;"Instituto de Investigaciones Marinas y Costeras "Jose Benito Vives De Andreis"";"1996-1998, 2001-2019";"Oceanography (Q3); Water Science and Technology (Q3); Animal Science and Zoology (Q4); Aquatic Science (Q4)"
1085;21811;"Farmacia Hospitalaria";journal;"21718695, 11306343";0,162;Q3;23;80;223;1436;75;165;0,31;17,95;Spain;Western Europe;"Grupo Aula Medica S.A.";"1990-2020";"Medicine (miscellaneous) (Q3); Pharmacology (Q4)"
1086;5900153316;"Journal of Medical Biochemistry";journal;"14528258, 14528266";0,162;Q3;17;43;141;1273;23;139;0,19;29,60;Serbia;Eastern Europe;"Society of Medical Biochemists of Serbia";"2007-2019";"Biochemistry (medical) (Q3); Clinical Biochemistry (Q4)"
1087;20500195068;"Journal of Microwaves, Optoelectronics and Electromagnetic Applications";journal;"21791074";0,162;Q3;17;11;69;159;15;67;0,23;14,45;Brazil;Latin America;"Brazilian Microwave and Optoelectronics Society";"2011-2020";"Electrical and Electronic Engineering (Q3)"
1088;21100812611;"Journal of the Belgian Society of Radiology";journal;"25148281";0,161;Q3;24;86;267;681;71;262;0,24;7,92;United Kingdom;Western Europe;"Ubiquity Press";"2015-2020";"Radiology, Nuclear Medicine and Imaging (Q3)"
1089;26828;"Studia Quaternaria";journal;"16415558";0,160;Q3;14;7;37;280;8;36;0,16;40,00;Poland;Eastern Europe;"Polska Akademia Nauk";"2000-2020";"Earth-Surface Processes (Q3); Geology (Q3)"
1090;16201;"Acta Botanica Croatica";journal;"03650588, 18478476";0,158;Q4;22;17;52;481;13;52;0,26;28,29;Croatia;Eastern Europe;"University of Zagreb";"1980-1983, 1985, 1996, 1998-2020";"Ecology, Evolution, Behavior and Systematics (Q4); Plant Science (Q4)"
1091;21100370876;"Annali di Botanica";journal;"22393129, 03650812";0,158;Q4;18;7;41;260;8;41;0,26;37,14;Italy;Western Europe;"Department of Environmental Biology, University La Sapienza of Rome";"1996-2000, 2002-2008, 2011-2020";"Plant Science (Q4)"
1092;28155;"Bangladesh Medical Research Council Bulletin";journal;"03779238";0,158;Q3;19;15;49;288;16;49;0,06;19,20;Bangladesh;Asiatic Region;"Bangladesh Medical Research Council";"1975-2019";"Medicine (miscellaneous) (Q3)"
1093;12570;"BELGEO";journal;"13772368, 22949135";0,158;Q3;13;28;95;824;25;90;0,22;29,43;Belgium;Western Europe;"Societe Royale Belge De Geographie";"2002-2019";"Earth-Surface Processes (Q3); Geography, Planning and Development (Q3)"
1094;18367;"Medicina";journal;"16699106, 00257680";0,158;Q3;32;132;352;2924;89;230;0,22;22,15;Argentina;Latin America;"Instituto de Investigaciones Medicas";"1945-2020";"Medicine (miscellaneous) (Q3)"
1095;20710;"DARU, Journal of Pharmaceutical Sciences";journal;"15608115, 20082231";0,157;Q3;42;40;96;1102;26;96;0,27;27,55;United Kingdom;Western Europe;"BioMed Central Ltd.";"2000-2020";"Medicine (miscellaneous) (Q3); Drug Discovery (Q4); Pharmacology (Q4)"
1096;17948;"Dendrobiology";journal;"16411307";0,157;Q3;19;19;49;269;10;49;0,20;14,16;Poland;Eastern Europe;"Polska Akademia Nauk";"2000-2001, 2004-2020";"Forestry (Q3); Plant Science (Q4)"
1097;29821;"Antarctic Record";journal;"00857289";0,156;Q3;9;15;56;153;9;56;0,18;10,20;Japan;Asiatic Region;"National Institute of Polar Research";"1979-1986, 1990-2020";"Earth and Planetary Sciences (miscellaneous) (Q3); Aquatic Science (Q4)"
1098;34097;"Archivos de Cardiologia de Mexico";journal;"14059940";0,156;Q4;17;119;227;3477;71;208;0,26;29,22;Mexico;Latin America;"Instituto Nacional de Cardiologia Ignazio Chavez";"2001-2020";"Cardiology and Cardiovascular Medicine (Q4)"
1099;17300154921;"Earthquake Science";journal;"18678777, 16744519";0,156;Q3;23;68;201;1158;32;201;0,17;17,03;China;Asiatic Region;"Seismological Society of China";"2009-2019";"Geology (Q3); Geotechnical Engineering and Engineering Geology (Q3); Geophysics (Q4)"
1100;18800156721;"Electronic Journal of Research in Educational Psychology";journal;"16962095, 16995880";0,156;Q3;26;45;63;1580;13;58;0,21;35,11;Spain;Western Europe;"Universidad de Almeria";"2003-2019";"Education (Q3); Developmental and Educational Psychology (Q4)"
1101;22476;"Informacion Tecnologica";journal;"07180764, 07168756";0,156;Q2;14;95;270;1412;16;261;0,07;14,86;Chile;Latin America;"Centro de Informacion Tecnologica";"1996-2020";"Energy (miscellaneous) (Q2); Industrial and Manufacturing Engineering (Q2); Geotechnical Engineering and Engineering Geology (Q3); Computer Science Applications (Q4); Food Science (Q4); Strategy and Management (Q4)"
1102;144786;"Journal of Japan Industrial Management Association";journal;"13422618, 21879079";0,156;Q2;8;54;79;733;5;78;0,06;13,57;Japan;Asiatic Region;"Nihon Keikei Kogakkai";"2004-2020";"Industrial and Manufacturing Engineering (Q2); Applied Mathematics (Q4); Management Science and Operations Research (Q4); Strategy and Management (Q4)"
1103;145707;"Technological and Economic Development of Economy";journal;"20294921, 20294913";0,156;Q4;47;54;36;781;9;36;0,25;14,46;Lithuania;Eastern Europe;"Vilnius Gediminas Technical University";"2005-2020";"Finance (Q4)"
1104;26181;"Trimestre Economico";journal;"00413011";0,156;Q4;11;29;79;870;10;77;0,08;30,00;Mexico;Latin America;"Fondo de Cultura Economica";"1979, 1981, 1989, 1996-2020";"Economics and Econometrics (Q4)"
1105;19200156920;"Biotechnology, Agronomy and Society and Environment";journal;"13706233, 17804507";0,155;Q3;36;39;79;813;25;72;0,26;20,85;Belgium;Western Europe;"Les Presses Agronomiques de Gembloux";"1997-2020";"Forestry (Q3); Geography, Planning and Development (Q3); Agronomy and Crop Science (Q4); Biotechnology (Q4); Plant Science (Q4)"
1106;4000149001;"Cancer Imaging";journal;"17405025, 14707330";0,155;Q3;48;54;113;1069;38;100;0,44;19,80;United Kingdom;Western Europe;"BioMed Central Ltd.";"2000-2020";"Medicine (miscellaneous) (Q3); Oncology (Q3); Radiology, Nuclear Medicine and Imaging (Q3); Radiological and Ultrasound Technology (Q4)"
1107;23372;"Chemicke Listy";journal;"12137103, 00092770";0,155;Q4;28;84;533;3099;103;533;0,17;36,89;Czech Republic;Eastern Europe;"Czech Society of Chemical Engineering";"1996-2020";"Chemistry (miscellaneous) (Q4)"
1108;27644;"Curationis";journal;"03798577";0,155;Q3;21;45;111;165;33;105;0,28;3,67;South Africa;Africa;"Democratic Nursing Organisation of South Africa";"1978-2020";"Medicine (miscellaneous) (Q3)"
1109;51878;"Medicina";journal;"1010660X, 16489144";0,155;Q3;36;137;594;1573;194;592;0,31;11,48;Lithuania;Eastern Europe;"Kauno Medicinos Universitetas";"2002-2020";"Medicine (miscellaneous) (Q3)"
1110;17698;"Puerto Rico Health Sciences Journal";journal;"07380658";0,155;Q3;25;44;143;352;45;140;0,25;8,00;Puerto Rico;Latin America;"University of Puerto Rico Medical Sciences Campus";"1985-2020";"Medicine (miscellaneous) (Q3)"
1111;33094;"Bodenkultur";journal;"00065471";0,154;Q4;18;24;71;625;11;71;0,12;26,04;Germany;Western Europe;"De Gruyter Open Ltd.";"1974, 1976-1977, 1979-1981, 1983-1985, 1987-1988, 1993-2020";"Agronomy and Crop Science (Q4); Animal Science and Zoology (Q4); Soil Science (Q4)"
1112;13793;"Community Eye Health Journal";journal;"09536833, 19937288";0,154;Q3;22;29;80;115;9;60;0,12;3,97;United Kingdom;Western Europe;"International Centre for Eye Health";"1988, 1996-2020";"Ophthalmology (Q3)"
1113;12732;"Ginecologia y Obstetricia de Mexico";journal;"03009041";0,154;Q3;16;115;298;1627;57;253;0,19;14,15;Mexico;Latin America;"Asociacion Mexicana de Ginecologia y Obstetricia";"1946-2020";"Medicine (miscellaneous) (Q3); Obstetrics and Gynecology (Q3)"
1114;130045;"Journal of Applied Biomedicine";journal;"12140287, 1214021X";0,154;Q3;30;22;26;952;23;23;0,88;43,27;Spain;Western Europe;"Elsevier Espana";"2005-2020";"Agricultural and Biological Sciences (miscellaneous) (Q3); Biochemistry, Genetics and Molecular Biology (miscellaneous) (Q3); Medicine (miscellaneous) (Q3); Pharmacology, Toxicology and Pharmaceutics (miscellaneous) (Q3); Neuroscience (miscellaneous) (Q4)"
1115;145096;"Neuropsychopharmacologia Hungarica";journal;"14198711";0,154;Q3;16;27;61;553;17;50;0,28;20,48;Hungary;Eastern Europe;"Hungarian Association of Psychopharmacology";"2004-2020";"Pharmacology, Toxicology and Pharmaceutics (miscellaneous) (Q3); Neurology (clinical) (Q4); Neuropsychology and Physiological Psychology (Q4); Neuroscience (miscellaneous) (Q4)"
1116;21603;"Periodica Polytechnica, Mechanical Engineering";journal;"03246051";0,154;Q3;16;12;49;112;14;49;0,30;9,33;Hungary;Eastern Europe;"Budapest University of Technology and Economics";"1969-1992, 1994-2020";"Mechanical Engineering (Q3)"
1117;16698;"Revista Brasileira de Plantas Medicinais";journal;"1983084X, 15160572";0,154;Q3;27;28;116;637;17;115;0,08;22,75;Brazil;Latin America;"Instituto de Biociencias";"1999-2016";"Complementary and Alternative Medicine (Q3); Pharmacology (Q4)"
1118;29546;"Australian Journal of Educational and Developmental Psychology";journal;"14465442";0,153;Q3;21;5;29;182;14;29;0,46;36,40;Australia;Pacific Region;"University of Newcastle";"2001-2017";"Education (Q3); Developmental and Educational Psychology (Q4)"
1119;21484;"Iranian Journal of Public Health";journal;"22516085, 22516093";0,153;Q4;39;57;98;1262;20;96;0,20;22,14;Iran;Middle East;"Iranian Journal of Public Health";"1973-1980, 1987, 2004-2020";"Public Health, Environmental and Occupational Health (Q4)"
1120;57468;"Journal of Preventive Medicine and Hygiene";journal;"11212233";0,153;Q4;27;27;43;686;9;41;0,21;25,41;Italy;Western Europe;"Pacini Editore s.r.l.";"1992-1995, 2004-2020";"Infectious Diseases (Q4); Public Health, Environmental and Occupational Health (Q4)"
1121;27495;"Annals of Saudi Medicine";journal;"02564947";0,152;Q3;44;123;374;2084;112;283;0,37;16,94;Saudi Arabia;Middle East;"King Faisal Specialist Hospital and Research Centre";"1988-2020";"Medicine (miscellaneous) (Q3)"
1122;4700152427;"Electronic Notes in Discrete Mathematics";journal;"15710653";0,152;Q4;26;170;480;911;66;474;0,16;5,36;Netherlands;Western Europe;"Elsevier";"1999-2019";"Applied Mathematics (Q4); Discrete Mathematics and Combinatorics (Q4)"
1123;15238;"Iranian Biomedical Journal";journal;"2008823X, 1028852X";0,152;Q3;31;33;98;787;27;97;0,32;23,85;Iran;Middle East;"Pasteur Institute of Iran";"1999-2020";"Biochemistry, Genetics and Molecular Biology (miscellaneous) (Q3); Biochemistry (medical) (Q4); Clinical Biochemistry (Q4)"
1124;13585;"Kemija u industriji/Journal of Chemists and Chemical Engineers (discontinued)";journal;"00229830";0,152;Q3;11;34;165;944;21;147;0,15;27,76;Croatia;Eastern Europe;"Assoc. of Chemists and Chemical Engineers of Croatia";"1993-1999, 2001-2017";"Chemical Engineering (miscellaneous) (Q3); Chemistry (miscellaneous) (Q4)"
1125;12465;"Quaestiones Geographicae";journal;"20816383, 0137477X";0,152;Q3;18;18;15;254;1;15;0,07;14,11;Poland;Eastern Europe;"Adam Mickiewicz University Press";"1979-1985, 1987, 1989, 1992, 1995-1998, 2001-2002, 2004-2020";"Earth and Planetary Sciences (miscellaneous) (Q3)"
1126;23547;"Singapore Dental Journal";journal;"03775291";0,152;Q3;11;10;19;344;4;19;0,21;34,40;Singapore;Asiatic Region;"Elsevier (Singapore) Pte Ltd";"1974, 1976-1977, 1979-1990, 1993-1997, 2000-2001, 2004-2007, 2010-2013, 2017";"Dentistry (miscellaneous) (Q3)"
1127;29731;"Acta Adriatica";journal;"00015113, 18460453";0,151;Q3;21;23;19;703;6;19;0,32;30,57;Croatia;Eastern Europe;"Institute of Oceanography and Fisheries";"1973, 1980, 1982-1983, 1985, 2000-2002, 2005-2020";"Oceanography (Q3)"
