Rank;Sourceid;Title;Type;Issn;SJR;SJR Best Quartile;H index;Total Docs. (2009);Total Docs. (3years);Total Refs.;Total Cites (3years);Citable Docs. (3years);Cites / Doc. (2years);Ref. / Doc.;Country;Region;Publisher;Coverage;Categories
806;11000153762;"Journal of Immunotoxicology";journal;"1547691X, 15476901";0,367;Q3;36;33;111;1274;133;110;1,27;38,61;United States;Northern America;"Informa Healthcare";"2004-2020";"Toxicology (Q3); Immunology (Q4)"
807;14000156235;"Aerosol and Air Quality Research";journal;"20711409, 16808584";0,366;Q2;55;40;32;1269;55;32;1,72;31,73;Taiwan;Asiatic Region;"AAGR Aerosol and Air Quality Research";"2008-2020";"Pollution (Q2); Environmental Chemistry (Q4)"
808;33067;"Arquivos Brasileiros de Cardiologia";journal;"0066782X";0,364;Q3;53;277;692;7044;649;644;0,99;25,43;Brazil;Latin America;"Arquivos Brasileiros de Cardiologia";"1950-2020";"Cardiology and Cardiovascular Medicine (Q3)"
809;19700174653;"Mobile Information Systems";journal;"1875905X, 1574017X";0,364;Q2;34;21;52;486;62;51;1,44;23,14;Egypt;Africa/Middle East;"Hindawi Limited";"2005-2020";"Computer Networks and Communications (Q2); Computer Science Applications (Q3)"
810;23885;"Terrestrial, Atmospheric and Oceanic Sciences";journal;"10170839, 23117680";0,364;Q2;46;71;178;2040;139;171;0,61;28,73;Taiwan;Asiatic Region;"Chinese Geoscience Union";"1996-2020";"Earth and Planetary Sciences (miscellaneous) (Q2); Oceanography (Q2); Atmospheric Science (Q3)"
811;22190;"Genetics and Molecular Research";journal;"16765680";0,363;Q2;48;162;355;4114;363;350;0,89;25,40;Brazil;Latin America;"Fundacao de Pesquisas Cientificas de Ribeirao Preto";"2002-2020";"Medicine (miscellaneous) (Q2); Genetics (Q4); Molecular Biology (Q4)"
812;24836;"Indian Journal of Dermatology, Venereology and Leprology";journal;"03786323, 09733922";0,361;Q2;45;261;613;3018;445;364;0,72;11,56;India;Asiatic Region;"Wolters Kluwer Medknow Publications";"1976-1982, 1985-1995, 2002-2020";"Dermatology (Q2); Infectious Diseases (Q3)"
813;19494;"Veterinarni Medicina";journal;"18059392, 03758427";0,360;Q2;50;92;226;2963;234;226;0,83;32,21;Czech Republic;Eastern Europe;"Czech Academy of Agricultural Sciences";"1971-2020";"Veterinary (miscellaneous) (Q2)"
814;4400151517;"Cell Communication and Signaling";journal;"1478811X";0,359;Q3;63;26;20;2873;18;18;0,75;110,50;United Kingdom;Western Europe;"Signal Transduction Society";"2003-2020";"Biochemistry (Q3); Cell Biology (Q4); Molecular Biology (Q4)"
815;200147134;"First Monday";journal;"13960466";0,359;Q2;70;74;436;2240;345;422;0,83;30,27;United States;Northern America;"First Monday";"1996-2019";"Computer Networks and Communications (Q2); Law (Q2); Human-Computer Interaction (Q3)"
816;19200157040;"Ciencia e Agrotecnologia";journal;"14137054, 19811829";0,358;Q2;30;278;400;5651;212;400;0,53;20,33;Brazil;Latin America;"Federal University of Lavras";"2007-2020";"Agronomy and Crop Science (Q2); Animal Science and Zoology (Q2); Food Science (Q2); Veterinary (miscellaneous) (Q2); Soil Science (Q3)"
817;27182;"Experimental Animals";journal;"13411357";0,358;Q2;42;56;135;1424;126;135;0,79;25,43;Japan;Asiatic Region;"International Press Editing Centre Incorporation";"1974-1980, 1995-2020";"Animal Science and Zoology (Q2); Biochemistry, Genetics and Molecular Biology (miscellaneous) (Q2); Medicine (miscellaneous) (Q2); Veterinary (miscellaneous) (Q2)"
818;25879;"International Journal of Molecular Sciences";journal;"14220067, 16616596";0,358;Q2;162;294;314;19404;457;313;1,51;66,00;Switzerland;Western Europe;"MDPI Multidisciplinary Digital Publishing Institute";"2000-2020";"Medicine (miscellaneous) (Q2); Computer Science Applications (Q3); Inorganic Chemistry (Q3); Organic Chemistry (Q3); Physical and Theoretical Chemistry (Q3); Catalysis (Q4); Molecular Biology (Q4); Spectroscopy (Q4)"
819;4500151501;"Planta Daninha";journal;"01008358";0,358;Q2;31;127;300;3141;379;300;1,26;24,73;Brazil;Latin America;"Sociedade Brasileira da Ciencia das Plantas Daninhas";"2006-2020";"Agronomy and Crop Science (Q2); Biochemistry (Q3); Plant Science (Q3); Physiology (Q4)"
820;96929;"Maydica";journal;"00256153";0,357;Q2;34;48;138;1707;101;136;0,65;35,56;Italy;Western Europe;"Experimental Institute for Cereal Research";"1993-2020";"Agronomy and Crop Science (Q2); Plant Science (Q3); Genetics (Q4)"
821;85143;"Records of the Australian Museum";journal;"00671975";0,357;Q1;22;10;32;450;33;32;0,56;45,00;Australia;Pacific Region;"Australian Museum";"1983, 2005-2012, 2014-2020";"History (Q1); Museology (Q1); Animal Science and Zoology (Q2); Ecology, Evolution, Behavior and Systematics (Q3)"
822;18748;"Acta Amazonica";journal;"00445967";0,356;Q2;30;120;256;3360;154;256;0,42;28,00;Brazil;Latin America;"Instituto Nacional de Pesquisas da Amazonia";"1979, 2006-2020";"Agricultural and Biological Sciences (miscellaneous) (Q2)"
823;24119;"African Zoology";journal;"15627020";0,356;Q3;28;17;109;606;69;109;0,60;35,65;United Kingdom;Western Europe;"Taylor and Francis Ltd.";"1996-2020";"Animal Science and Zoology (Q3)"
824;19700175301;"Bulletin Mathematique de la Societe des Sciences Mathematiques de Roumanie";journal;"12203874";0,355;Q3;20;36;27;631;12;27;0,44;17,53;Romania;Eastern Europe;"Societatea de Stiinte Matematice din Romania";"2008-2019";"Mathematics (miscellaneous) (Q3)"
825;25507;"Informatica (Slovenia)";journal;"18543871, 03505596";0,355;Q3;34;50;145;1400;187;137;1,05;28,00;Slovenia;Eastern Europe;"Slovene Society Informatika";"1995-2020";"Artificial Intelligence (Q3); Computer Science Applications (Q3); Software (Q3); Theoretical Computer Science (Q3)"
826;4000151902;"Journal of the Canadian Academy of Child and Adolescent Psychiatry";journal;"17198429";0,355;Q3;34;50;80;1045;54;57;0,42;20,90;Canada;Northern America;"Canadian Academy of Child and Adolescent Psychiatry";"2006-2020";"Pediatrics, Perinatology and Child Health (Q3); Psychiatry and Mental Health (Q3)"
827;12935;"Acoustical Science and Technology";journal;"13463969, 13475177";0,354;Q2;37;67;193;1141;143;190;0,81;17,03;Japan;Asiatic Region;"Acoustical Society of Japan";"2000-2020";"Acoustics and Ultrasonics (Q2)"
828;13427;"Bulletin of the Polish Academy of Sciences: Technical Sciences";journal;"23001917, 02397528";0,354;Q2;41;44;153;1070;174;152;1,17;24,32;Poland;Eastern Europe;"Polish Academy of Sciences";"1983-1988, 1999-2000, 2002-2020";"Computer Networks and Communications (Q2); Engineering (miscellaneous) (Q2); Artificial Intelligence (Q3); Atomic and Molecular Physics, and Optics (Q3); Information Systems (Q3)"
829;19900193635;"Journal of Maps";journal;"17445647";0,354;Q2;35;30;95;355;47;88;0,45;11,83;United Kingdom;Western Europe;"Taylor and Francis Ltd.";"2005-2021";"Earth and Planetary Sciences (miscellaneous) (Q2); Geography, Planning and Development (Q2)"
830;68435;"Plant, Soil and Environment";journal;"12141178, 18059368";0,353;Q3;55;74;231;1865;192;231;0,80;25,20;Czech Republic;Eastern Europe;"Czech Academy of Agricultural Sciences";"2003-2020";"Soil Science (Q3)"
831;13715;"Entropy";journal;"10994300";0,352;Q3;74;62;80;1986;100;78;1,52;32,03;Switzerland;Western Europe;"MDPI Multidisciplinary Digital Publishing Institute";"1999-2020";"Physics and Astronomy (miscellaneous) (Q3)"
832;14046;"Library Philosophy and Practice";journal;"15220222";0,352;Q1;20;111;155;2232;62;153;0,39;20,11;United States;Northern America;"University of Idaho Library";"1998-2020";"Philosophy (Q1); Library and Information Sciences (Q2)"
833;3900148511;"Stomatologija";journal;"13928589";0,352;Q2;22;22;67;66;29;66;0,37;3,00;Lithuania;Eastern Europe;"Ausra";"2005-2020";"Medicine (miscellaneous) (Q2)"
834;34696;"Turk Tarim ve Ormancilik Dergisi/Turkish Journal of Agriculture and Forestry";journal;"1300011X, 13036173";0,352;Q2;43;62;155;1997;136;154;0,85;32,21;Turkey;Middle East;"Turkiye Klinikleri Journal of Medical Sciences";"1994-2020";"Food Science (Q2); Forestry (Q2); Ecology (Q3)"
835;23489;"Chemical Speciation and Bioavailability";journal;"09542299";0,351;Q2;0;0;0;0;0;0;0,00;0,00;United Kingdom;Western Europe;"Taylor and Francis Ltd.";"1989-2018";"Chemical Health and Safety (Q2); Health, Toxicology and Mutagenesis (Q3); Toxicology (Q3)"
836;5000153703;"Computational and Applied Mathematics";journal;"18070302, 22383603";0,351;Q3;29;18;49;375;28;48;0,43;20,83;United States;Northern America;"Birkhauser Boston";"2003-2020";"Applied Mathematics (Q3); Computational Mathematics (Q3)"
837;28002;"Revista de Nutricao";journal;"14155273";0,351;Q2;36;81;215;2663;121;210;0,42;32,88;Brazil;Latin America;"";"2000-2020";"Medicine (miscellaneous) (Q2); Nutrition and Dietetics (Q2)"
838;4700152233;"Therapeutics and Clinical Risk Management";journal;"11766336";0,351;Q1;55;101;319;5725;433;307;1,40;56,68;New Zealand;Pacific Region;"Dove Medical Press Ltd.";"2006-2020";"Pharmacology, Toxicology and Pharmaceutics (miscellaneous) (Q1); Chemical Health and Safety (Q2); Medicine (miscellaneous) (Q2); Pharmacology (medical) (Q2); Safety Research (Q2)"
839;25953;"Dados";journal;"16784588, 00115258";0,350;Q2;26;28;83;1401;20;83;0,28;50,04;Brazil;Latin America;"Inst. Univ. de Pesquisas do Rio de Janeiro";"1996-2020";"Social Sciences (miscellaneous) (Q2)"
840;11700154337;"Nuclear Engineering and Technology";journal;"2234358X, 17385733";0,350;Q2;40;128;65;2729;58;64;0,89;21,32;South Korea;Asiatic Region;"Korean Nuclear Society";"2008-2020";"Nuclear Energy and Engineering (Q2)"
841;27155;"BMC Nursing";journal;"14726955";0,349;Q2;39;9;35;350;43;35;0,77;38,89;United Kingdom;Western Europe;"BioMed Central Ltd.";"2002-2020";"Nursing (miscellaneous) (Q2)"
842;130096;"Taiwanese Journal of Obstetrics and Gynecology";journal;"10284559";0,349;Q2;35;99;290;2101;261;221;0,87;21,22;Taiwan;Asiatic Region;"Elsevier Taiwan LLC";"2004-2020";"Obstetrics and Gynecology (Q2)"
843;22392;"Indian Journal of Pharmaceutical Sciences";journal;"0250474X, 19983743";0,347;Q2;57;149;620;2725;620;617;0,77;18,29;India;Asiatic Region;"Wolters Kluwer Medknow Publications";"1978-2020";"Pharmaceutical Science (Q2)"
844;18924;"Journal of Genetics";journal;"09737731, 00221333";0,347;Q4;37;48;150;2320;129;141;0,83;48,33;India;Asiatic Region;"Springer India";"1910-1960, 1962-1966, 1968, 1970-1972, 1974-1977, 1985-2020";"Genetics (Q4)"
845;39600;"Milchwissenschaft";journal;"00263788";0,347;Q2;39;89;277;1769;147;277;0,48;19,88;Germany;Western Europe;"AVA-Verlag Allgau";"1973-1989, 1996-2012";"Food Science (Q2)"
846;18852;"Revista Brasileira de Zootecnia";journal;"18069290, 15163598";0,347;Q3;53;374;884;10989;602;880;0,55;29,38;Brazil;Latin America;"Sociedade Brasileira de Zootecnia";"1996-2020";"Animal Science and Zoology (Q3)"
847;17265;"Blumea: Journal of Plant Taxonomy and Plant Geography";journal;"00065196";0,346;Q3;25;48;102;1179;33;102;0,26;24,56;Netherlands;Western Europe;"National Herbarium Nederland";"1993-2020";"Ecology, Evolution, Behavior and Systematics (Q3); Plant Science (Q3)"
848;27951;"Annales de la Fondation Louis de Broglie";journal;"01824295";0,345;Q3;16;20;89;340;28;88;0,37;17,00;France;Western Europe;"Fondation Louis de Broglie";"1996-2014, 2016-2018";"Physics and Astronomy (miscellaneous) (Q3)"
849;19200156904;"Chalcogenide Letters";journal;"15848663";0,345;Q2;30;93;85;1964;69;84;0,77;21,12;Romania;Eastern Europe;"National Institute R and D of Materials Physics";"2006-2020";"Chemistry (miscellaneous) (Q2); Electronic, Optical and Magnetic Materials (Q3); Physics and Astronomy (miscellaneous) (Q3)"
850;15073;"Folia Biologica";journal;"25337602, 00155500";0,345;Q2;33;37;95;1280;103;91;1,06;34,59;Czech Republic;Eastern Europe;"Charles University";"1961-2020";"Medicine (miscellaneous) (Q2); Biochemistry (Q3); Cell Biology (Q4); Developmental Biology (Q4); Genetics (Q4); Immunology (Q4); Molecular Biology (Q4)"
851;23100;"Proceedings of the Japan Academy Series B: Physical and Biological Sciences";journal;"13492896, 03862208";0,345;Q1;55;41;98;1783;103;98;1,18;43,49;Japan;Asiatic Region;"Japan Academy";"1977-2020";"Multidisciplinary (Q1); Agricultural and Biological Sciences (miscellaneous) (Q2); Medicine (miscellaneous) (Q2); Physics and Astronomy (miscellaneous) (Q3)"
852;14358;"Revista Brasileira de Otorrinolaringologia";journal;"00347299";0,345;Q2;28;0;70;0;59;67;0,00;0,00;Brazil;Latin America;"Sociedade Brasileira de Otorrinolaringologia";"1945, 1947-1948, 1950-1959, 1973-1981, 1990-2006";"Otorhinolaryngology (Q2)"
853;4500151509;"International Journal of Applied Mathematics and Computer Science";journal;"1641876X";0,344;Q2;47;55;142;1346;174;142;1,24;24,47;Germany;Western Europe;"Walter de Gruyter GmbH";"2001-2002, 2006-2020";"Computer Science (miscellaneous) (Q2); Engineering (miscellaneous) (Q2); Applied Mathematics (Q3)"
854;16349;"Brazilian Journal of Chemical Engineering";journal;"01046632";0,342;Q2;52;73;193;1856;148;193;0,65;25,42;Brazil;Latin America;"Association Brasiliera de Eng. Quimica / Braz. Soc. Chem. Eng.";"1995-2020";"Chemical Engineering (miscellaneous) (Q2)"
855;12306;"Nippon Kinzoku Gakkaishi/Journal of the Japan Institute of Metals";journal;"18806880, 00214876";0,342;Q2;29;142;523;2684;228;522;0,40;18,90;Japan;Asiatic Region;"Japan Institute of Metals (JIM)";"1937-1944, 1948-1949, 1969-1992, 1994-2020";"Materials Chemistry (Q2); Metals and Alloys (Q2); Condensed Matter Physics (Q3); Mechanics of Materials (Q3)"
856;4900153108;"Papeis Avulsos de Zoologia";journal;"00311049, 18070205";0,342;Q3;26;44;79;1649;42;79;0,57;37,48;Brazil;Latin America;"University of Sao Paolo";"2002-2020";"Animal Science and Zoology (Q3)"
857;4700152838;"Acta Geophysica";journal;"18957455, 18956572";0,341;Q3;35;60;148;1784;128;141;0,94;29,73;Switzerland;Western Europe;"Springer International Publishing AG";"2006-2020";"Geophysics (Q3)"
858;76019;"Acta Mathematica Universitatis Comenianae";journal;"13360310, 08629544";0,341;Q3;16;32;83;381;31;83;0,43;11,91;Slovakia;Eastern Europe;"Univerzita Komenskeho";"2002-2019";"Mathematics (miscellaneous) (Q3)"
859;13831;"Chinese Journal of Aeronautics";journal;"10009361";0,341;Q2;50;100;267;1704;170;267;0,83;17,04;China;Asiatic Region;"Chinese Journal of Aeronautics";"1990-1991, 1996-2020";"Aerospace Engineering (Q2); Mechanical Engineering (Q2)"
860;16582;"Plant Biotechnology";journal;"13476114, 13424580";0,341;Q2;40;79;245;2413;217;241;0,87;30,54;Japan;Asiatic Region;"Japanese Society for Plant Cell and Molecular Biology";"1997-2020";"Agronomy and Crop Science (Q2); Biotechnology (Q3); Plant Science (Q3)"
861;30008;"Revista da Escola de Enfermagem da U S P";journal;"00806234";0,341;Q2;28;205;297;3378;160;285;0,44;16,48;Brazil;Latin America;"University of Sao Paolo";"1967-2020";"Nursing (miscellaneous) (Q2)"
862;38490;"Bragantia";journal;"00068705";0,340;Q2;32;119;291;2998;129;290;0,38;25,19;Brazil;Latin America;"Instituto Agronomico";"1977, 1979, 1985, 1992-2020";"Agricultural and Biological Sciences (miscellaneous) (Q2); Materials Science (miscellaneous) (Q2)"
863;13852;"Applied Rheology";journal;"16178106, 14306395";0,339;Q2;29;39;128;664;84;111;0,73;17,03;Germany;Western Europe;"Kerschensteiner Verlag GmbH";"1996-1997, 1999-2020";"Materials Science (miscellaneous) (Q2); Condensed Matter Physics (Q3)"
864;13569;"Journal of Pesticide Sciences";journal;"13490923, 1348589X";0,338;Q3;37;49;161;882;149;160;0,84;18,00;Japan;Asiatic Region;"Pesticide Science Society of Japan";"1975-2020";"Health, Toxicology and Mutagenesis (Q3); Insect Science (Q3)"
865;14786;"Nutricion Hospitalaria";journal;"16995198, 02121611";0,338;Q2;53;123;344;3307;375;311;1,06;26,89;Spain;Western Europe;"ARAN Ediciones S.A.";"1989-2020";"Medicine (miscellaneous) (Q2); Nutrition and Dietetics (Q2)"
866;26563;"Acta Medica Okayama";journal;"0386300X";0,337;Q2;37;49;152;1345;167;152;1,04;27,45;Japan;Asiatic Region;"Okayama University";"1972-2020";"Biochemistry, Genetics and Molecular Biology (miscellaneous) (Q2); Medicine (miscellaneous) (Q2)"
867;4000151812;"Ciencia Rural";journal;"01038478";0,337;Q2;36;454;1084;9908;534;1084;0,38;21,82;Brazil;Latin America;"Universidade Federal de Santa Maria";"2006-2020";"Agronomy and Crop Science (Q2); Veterinary (miscellaneous) (Q2); Animal Science and Zoology (Q3)"
868;15030;"Indian Pediatrics";journal;"09747559, 00196061";0,337;Q3;50;294;742;2784;457;451;0,58;9,47;India;Asiatic Region;"Springer India";"1964-2020";"Pediatrics, Perinatology and Child Health (Q3)"
869;145509;"Notices of the American Mathematical Society";journal;"00029920";0,337;Q3;37;45;337;633;86;169;0,26;14,07;United States;Northern America;"American Mathematical Society";"1995, 2004-2020";"Mathematics (miscellaneous) (Q3)"
870;20799;"Transport";journal;"16484142, 16483480";0,337;Q2;31;50;178;1074;344;177;2,53;21,48;Lithuania;Eastern Europe;"Vilnius Gediminas Technical University";"1980-1992, 2002-2020";"Automotive Engineering (Q2); Mechanical Engineering (Q2)"
871;21392;"Yonsei Medical Journal";journal;"19762437, 05135796";0,337;Q2;63;145;446;3851;508;442;1,04;26,56;South Korea;Asiatic Region;"Yonsei University College of Medicine";"1963-2020";"Medicine (miscellaneous) (Q2)"
872;5800207372;"Journal of Experimental Nanoscience";journal;"17458080, 17458099";0,336;Q2;37;36;94;849;81;89;0,55;23,58;United Kingdom;Western Europe;"Taylor and Francis Ltd.";"2006-2020";"Materials Science (miscellaneous) (Q2); Bioengineering (Q3); Biomedical Engineering (Q3); Nanoscience and Nanotechnology (Q4)"
873;32422;"Journal of International Medical Research";journal;"14732300, 03000605";0,336;Q2;57;235;393;6426;471;377;1,14;27,34;United Kingdom;Western Europe;"SAGE Publications Inc.";"1972-2020";"Biochemistry (medical) (Q2); Medicine (miscellaneous) (Q2); Biochemistry (Q3); Cell Biology (Q4)"
874;40173;"Asian Pacific Journal of Cancer Prevention";journal;"15137368";0,335;Q3;75;242;434;6812;500;401;0,99;28,15;Thailand;Asiatic Region;"Asian Pacific Organization for Cancer Prevention";"2000-2020";"Oncology (Q3); Public Health, Environmental and Occupational Health (Q3); Cancer Research (Q4); Epidemiology (Q4)"
875;21100812851;"Eurasip Journal on Information Security";journal;"2510523X, 16874161";0,335;Q3;25;16;30;338;41;28;1,37;21,13;United Kingdom;Western Europe;"Springer Open";"2007-2020";"Computer Science Applications (Q3); Signal Processing (Q3)"
876;13005;"Journal of Low Frequency Noise Vibration and Active Control";journal;"02630923, 20484046, 14613484";0,335;Q2;25;20;64;455;37;64;0,64;22,75;United Kingdom;Western Europe;"SAGE Publications Inc.";"1996-2020";"Acoustics and Ultrasonics (Q2); Building and Construction (Q2); Civil and Structural Engineering (Q2); Mechanical Engineering (Q2); Geophysics (Q3); Mechanics of Materials (Q3)"
877;20244;"Ulster Medical Journal";journal;"00416193";0,335;Q2;29;45;146;709;96;92;0,62;15,76;United Kingdom;Western Europe;"Ulster Medical Society";"1946-1947, 1950-2020";"Medicine (miscellaneous) (Q2)"
878;19300156901;"Dose-Response";journal;"15593258";0,333;Q3;36;19;21;1289;31;21;1,48;67,84;United States;Northern America;"International Dose-Response Society";"2008-2020";"Chemical Health and Safety (Q3); Health, Toxicology and Mutagenesis (Q3); Public Health, Environmental and Occupational Health (Q3); Toxicology (Q3)"
879;29608;"Journal of Limnology";journal;"11295767";0,333;Q2;44;38;78;1938;74;77;0,97;51,00;Italy;Western Europe;"PagePress Publications";"1997-2020";"Water Science and Technology (Q2); Aquatic Science (Q3); Ecology (Q3)"
880;27404;"Brazilian Journal of Physics";journal;"01039733";0,332;Q3;48;107;625;3075;349;614;0,59;28,74;United States;Northern America;"Springer New York";"1996-2020";"Physics and Astronomy (miscellaneous) (Q3)"
881;13520;"Early Childhood Research and Practice";journal;"15245039";0,332;Q3;24;18;48;493;17;48;0,33;27,39;United States;Northern America;"Early Childhood and Parenting Collaborative";"1999-2015";"Developmental and Educational Psychology (Q3); Pediatrics, Perinatology and Child Health (Q3)"
882;29230;"International Journal of Occupational Medicine and Environmental Health";journal;"12321087, 1896494X";0,332;Q2;46;38;115;1316;117;104;0,82;34,63;Poland;Eastern Europe;"Nofer Institute of Occupational Medicine";"1994-2020";"Medicine (miscellaneous) (Q2); Public Health, Environmental and Occupational Health (Q3)"
883;145537;"Journal of Universal Computer Science";journal;"0948695X, 09486968";0,332;Q2;53;159;469;3819;452;431;0,84;24,02;Austria;Western Europe;"Technische Universitat Graz from Austria";"1996-2020";"Computer Science (miscellaneous) (Q2); Theoretical Computer Science (Q3)"
884;25359;"Revista Espanola de Enfermedades Digestivas";journal;"11300108";0,332;Q2;38;211;632;3431;401;342;0,54;16,26;Spain;Western Europe;"ARAN Ediciones S.A.";"1990-2020";"Gastroenterology (Q2); Medicine (miscellaneous) (Q2)"
885;24077;"Acta Zoologica Academiae Scientiarum Hungaricae";journal;"12178837";0,331;Q3;24;28;109;659;57;106;0,46;23,54;Hungary;Eastern Europe;"Hungarian Natural History Museum";"1996-2020";"Animal Science and Zoology (Q3); Ecology, Evolution, Behavior and Systematics (Q3)"
886;19444;"American Journal of Pharmaceutical Education";journal;"15536467, 00029459";0,331;Q2;63;170;422;2949;451;391;0,98;17,35;United States;Northern America;"American Association of Colleges of Pharmacy";"1945-1948, 1973-1989, 1991, 1996-2020";"Education (Q2); Medicine (miscellaneous) (Q2); Pharmacology, Toxicology and Pharmaceutics (miscellaneous) (Q2)"
887;21100364911;"Creativity Studies";journal;"23450487, 23450479";0,331;Q1;9;17;22;277;4;20;0,18;16,29;Lithuania;Eastern Europe;"Vilnius Gediminas Technical University";"2014-2020";"Cultural Studies (Q1); Political Science and International Relations (Q2); Sociology and Political Science (Q2)"
888;21246;"International Journal of Immunopathology and Pharmacology";journal;"03946320";0,331;Q3;53;150;379;3944;839;368;2,52;26,29;Italy;Western Europe;"SAGE Publications Inc.";"1989-2020";"Immunology and Allergy (Q3); Pharmacology (Q3); Immunology (Q4)"
889;12170;"Modeling, Identification and Control";journal;"03327353, 18901328";0,331;Q2;26;16;43;472;18;41;0,52;29,50;Norway;Western Europe;"Research Council of Norway";"1980-1989, 1996-2020";"Control and Systems Engineering (Q2); Computer Science Applications (Q3); Modeling and Simulation (Q3); Software (Q3)"
890;5400152616;"Cerne";journal;"01047760";0,330;Q2;19;55;94;1088;31;94;0,33;19,78;Brazil;Latin America;"Federal University of Lavras";"2007-2020";"Forestry (Q2)"
891;15946;"Journal of Korean Medical Science";journal;"15986357, 10118934";0,330;Q2;66;279;652;5938;796;648;1,13;21,28;South Korea;Asiatic Region;"Korean Academy of Medical Science";"1986-2020";"Medicine (miscellaneous) (Q2)"
892;18659;"Anais da Academia Brasileira de Ciencias";journal;"00013765, 16782690";0,329;Q1;58;78;190;3902;248;186;1,23;50,03;Brazil;Latin America;"Academia Brasileira de Ciencias";"1945-1946, 1949, 1970-1992, 1994-2020";"Multidisciplinary (Q1)"
893;21082;"Pharmaceutical Biology";journal;"13880209, 17445116";0,328;Q1;64;188;370;5474;378;369;0,88;29,12;United Kingdom;Western Europe;"Taylor and Francis Ltd.";"1961-1972, 1975-2020";"Complementary and Alternative Medicine (Q1); Medicine (miscellaneous) (Q2); Pharmaceutical Science (Q2); Drug Discovery (Q3); Pharmacology (Q3); Molecular Medicine (Q4)"
894;5200152707;"Eurasip Journal on Image and Video Processing";journal;"16875281, 16875176";0,327;Q2;40;43;99;1405;117;94;1,18;32,67;United States;Northern America;"Springer Publishing Company";"2007-2020";"Electrical and Electronic Engineering (Q2); Information Systems (Q3); Signal Processing (Q3)"
895;26336;"Geologia Croatica";journal;"1330030X";0,327;Q2;28;16;45;620;17;43;0,31;38,75;Croatia;Eastern Europe;"Croatian Geological Survey";"1992-2020";"Earth and Planetary Sciences (miscellaneous) (Q2); Geology (Q3)"
896;145581;"International Journal of Photoenergy";journal;"1110662X, 1687529X";0,327;Q2;51;34;116;1311;123;112;1,18;38,56;United States;Northern America;"Hindawi Publishing Corporation";"1999-2020";"Chemistry (miscellaneous) (Q2); Materials Science (miscellaneous) (Q2); Renewable Energy, Sustainability and the Environment (Q2); Atomic and Molecular Physics, and Optics (Q3)"
897;4300151406;"Revista Brasileira de Entomologia";journal;"00855626, 18069665";0,327;Q3;31;104;229;2781;109;229;0,45;26,74;Brazil;Latin America;"Sociedade Brasileira de Entomologia";"2003, 2005-2020";"Insect Science (Q3)"
898;19600161813;"Advances in Tribology";journal;"16875915, 16875923";0,326;Q2;17;4;5;103;3;5;0,60;25,75;Egypt;Africa/Middle East;"Hindawi Limited";"2008-2020";"Mechanical Engineering (Q2); Surfaces, Coatings and Films (Q2)"
899;25823;"Complexity";journal;"10762787, 10990526";0,326;Q1;61;34;110;1112;112;93;0,93;32,71;Egypt;Africa/Middle East;"Hindawi Limited";"1995-2020";"Multidisciplinary (Q1)"
900;5400152628;"Revista Brasileira de Farmacognosia";journal;"0102695X, 1981528X";0,326;Q2;46;154;216;4842;646;207;2,99;31,44;Brazil;Latin America;"Springer Nature Switzerland AG";"2007-2020";"Pharmacology, Toxicology and Pharmaceutics (miscellaneous) (Q2)"
901;35693;"Science of Sintering";journal;"0350820X";0,326;Q2;25;35;101;605;55;101;0,57;17,29;Serbia;Eastern Europe;"International Institute for the Science of Sintering (IISS)";"1974-1976, 1978-1989, 2002-2020";"Ceramics and Composites (Q2); Materials Chemistry (Q2); Metals and Alloys (Q2); Condensed Matter Physics (Q3)"
902;19200157025;"Engineering Economics";journal;"13922785";0,325;Q2;29;56;58;2369;128;57;2,21;42,30;Lithuania;Eastern Europe;"Kauno Technologijos Universitetas";"2008-2020";"Business and International Management (Q2); Engineering (miscellaneous) (Q2); Economics and Econometrics (Q3)"
903;19317;"Salud Publica de Mexico";journal;"16067916, 00363634";0,325;Q3;54;180;504;5075;334;443;0,58;28,19;Mexico;Latin America;"Instituto Nacional de Salud Publica";"1961-2020";"Public Health, Environmental and Occupational Health (Q3)"
