Rank;Sourceid;Title;Type;Issn;SJR;SJR Best Quartile;H index;Total Docs. (2006);Total Docs. (3years);Total Refs.;Total Cites (3years);Citable Docs. (3years);Cites / Doc. (2years);Ref. / Doc.;Country;Region;Publisher;Coverage;Categories
516;24995;"Hematology";journal;"10245332, 16078454";0,384;Q3;43;69;280;2129;298;274;1,07;30,86;United Kingdom;Western Europe;"Taylor and Francis Ltd.";"1996-2020";"Hematology (Q3)"
517;51150;"Opto-electronics Review";journal;"12303402, 18963757";0,383;Q2;40;50;171;932;125;168;0,67;18,64;Netherlands;Western Europe;"Elsevier BV";"1996-2020";"Electrical and Electronic Engineering (Q2); Radiation (Q3)"
518;13935;"Journal of Micropalaeontology";journal;"0262821X, 20414978";0,381;Q3;29;19;49;965;34;43;0,75;50,79;United Kingdom;Western Europe;"Geological Society of London";"1982-2020";"Paleontology (Q3)"
519;28099;"BMC Medical Education";journal;"14726920";0,379;Q2;68;59;83;1445;92;83;1,03;24,49;United Kingdom;Western Europe;"BioMed Central Ltd.";"2001-2020";"Education (Q2); Medicine (miscellaneous) (Q2)"
520;4300151401;"BMC Veterinary Research";journal;"17466148";0,378;Q2;59;37;9;1253;13;9;1,44;33,86;United Kingdom;Western Europe;"BioMed Central Ltd.";"2005-2020";"Medicine (miscellaneous) (Q2); Veterinary (miscellaneous) (Q2)"
521;21264;"Drugs in R and D";journal;"11796901, 11745886";0,377;Q3;45;37;190;1816;238;190;1,44;49,08;United Kingdom;Western Europe;"Adis International Ltd";"1999, 2002-2008, 2010-2020";"Pharmacology (Q3)"
522;20638;"Texas Heart Institute Journal";journal;"07302347, 15266702";0,376;Q2;53;142;365;1779;249;298;0,62;12,53;United States;Northern America;"Texas Heart Institute";"1982-2020";"Medicine (miscellaneous) (Q2); Cardiology and Cardiovascular Medicine (Q3)"
523;22396;"Acta Myologica";journal;"11282460";0,375;Q2;33;18;79;334;60;71;0,63;18,56;Italy;Western Europe;"Gaetano Conte Academy";"1997-2020";"Medicine (miscellaneous) (Q2); Cardiology and Cardiovascular Medicine (Q3)"
524;21807;"Brazilian Journal of Infectious Diseases";journal;"14138670, 16784391";0,375;Q3;45;88;194;2445;215;190;0,93;27,78;Brazil;Latin America;"Elsevier Editora Ltda";"2000-2020";"Infectious Diseases (Q3); Microbiology (medical) (Q3)"
525;20569;"Electronic Notes in Theoretical Computer Science";journal;"15710661";0,375;Q2;60;556;1294;10271;884;1278;0,62;18,47;Netherlands;Western Europe;"Elsevier";"1995-2019";"Computer Science (miscellaneous) (Q2); Theoretical Computer Science (Q3)"
526;15854;"Journal of Circadian Rhythms";journal;"17403391";0,375;Q4;26;16;23;690;37;22;1,24;43,13;United Kingdom;Western Europe;"Ubiquity Press";"2003-2020";"Endocrine and Autonomic Systems (Q4); Physiology (Q4)"
527;27226;"Journal of Clinical Laboratory Analysis";journal;"08878013, 10982825";0,372;Q1;50;44;141;1123;177;141;1,29;25,52;United States;Northern America;"Wiley-Liss Inc.";"1987-2020";"Medical Laboratory Technology (Q1); Public Health, Environmental and Occupational Health (Q2); Biochemistry (medical) (Q3); Clinical Biochemistry (Q3); Hematology (Q3); Immunology and Allergy (Q3); Microbiology (medical) (Q3)"
528;78414;"Asian-Australasian Journal of Animal Sciences";journal;"10112367";0,369;Q2;59;284;847;8613;767;847;0,97;30,33;South Korea;Asiatic Region;"Asian-Australasian Association of Animal Production Societies";"1996-2020";"Food Science (Q2); Animal Science and Zoology (Q3)"
529;21100372826;"Alpine and Mediterranean Quaternary";journal;"22797335, 22797327";0,366;Q1;29;23;132;820;61;132;0,33;35,65;Italy;Western Europe;"AIQUA - Associazione Italiana per lo Studio del Quaternario";"1988-2019";"Archeology (arts and humanities) (Q1); Earth-Surface Processes (Q2); Geology (Q2); Paleontology (Q3)"
530;13223;"European Review for Medical and Pharmacological Sciences";journal;"11283602, 22840729";0,366;Q2;63;54;130;1609;150;127;1,28;29,80;Italy;Western Europe;"Verduci Editore";"1979-2020";"Medicine (miscellaneous) (Q2); Pharmacology (medical) (Q2)"
531;17773;"Mediators of Inflammation";journal;"09629351, 14661861";0,366;Q3;97;70;166;2063;192;163;0,98;29,47;United States;Northern America;"Hindawi Publishing Corporation";"1992-2020";"Immunology (Q3); Cell Biology (Q4)"
532;54469;"Journal of Applied Poultry Research";journal;"15370437, 10566171";0,364;Q3;63;69;268;2271;157;268;0,50;32,91;United States;Northern America;"Elsevier Inc.";"1992-2020";"Animal Science and Zoology (Q3)"
533;21392;"Yonsei Medical Journal";journal;"19762437, 05135796";0,364;Q2;63;132;510;3293;629;507;1,27;24,95;South Korea;Asiatic Region;"Yonsei University College of Medicine";"1963-2020";"Medicine (miscellaneous) (Q2)"
534;12000154553;"Journal of Otolaryngology - Head and Neck Surgery";journal;"19160216, 19160208";0,363;Q2;47;103;295;1986;171;289;0,41;19,28;United Kingdom;Western Europe;"Decker Publishing";"2008-2020";"Otorhinolaryngology (Q2); Surgery (Q2)"
535;20337;"Parasite";journal;"1252607X, 17761042";0,362;Q2;46;48;167;992;117;159;0,68;20,67;France;Western Europe;"EDP Sciences";"1994-2020";"Agricultural and Biological Sciences (miscellaneous) (Q2); Veterinary (miscellaneous) (Q2); Animal Science and Zoology (Q3); Infectious Diseases (Q3); Insect Science (Q3); Parasitology (Q3)"
536;29951;"Journal of Experimental and Clinical Cancer Research";journal;"17569966, 03929078";0,361;Q3;81;82;316;2648;300;313;1,07;32,29;United Kingdom;Western Europe;"BioMed Central Ltd.";"1982-2020";"Oncology (Q3); Cancer Research (Q4)"
537;16002;"Journal of Postgraduate Medicine";journal;"09722823, 00223859";0,361;Q2;52;118;357;1757;364;232;0,81;14,89;India;Asiatic Region;"Wolters Kluwer Medknow Publications";"1961-2020";"Medicine (miscellaneous) (Q2)"
538;15300154801;"Eurasip Journal on Advances in Signal Processing";journal;"16876172, 16876180";0,358;Q2;88;269;647;6410;839;619;1,16;23,83;United States;Northern America;"Springer Publishing Company";"2007-2020";"Electrical and Electronic Engineering (Q2); Hardware and Architecture (Q2); Signal Processing (Q3)"
539;21100826272;"European Zoological Journal";journal;"24750263";0,358;Q3;37;45;215;1517;131;212;0,61;33,71;United Kingdom;Western Europe;"Taylor and Francis Ltd.";"2017-2020";"Animal Science and Zoology (Q3)"
540;20524;"BMC Surgery";journal;"14712482";0,357;Q2;47;19;51;385;69;51;1,29;20,26;United Kingdom;Western Europe;"BioMed Central Ltd.";"2001-2020";"Medicine (miscellaneous) (Q2); Surgery (Q2)"
541;26806;"Ciencias Marinas";journal;"01853880";0,357;Q3;29;67;163;1956;93;162;0,43;29,19;Mexico;Latin America;"Universidad Autonoma de Baja California";"1992-2020";"Aquatic Science (Q3)"
542;25879;"International Journal of Molecular Sciences";journal;"14220067, 16616596";0,357;Q2;162;41;100;1513;102;97;0,71;36,90;Switzerland;Western Europe;"MDPI Multidisciplinary Digital Publishing Institute";"2000-2020";"Medicine (miscellaneous) (Q2); Computer Science Applications (Q3); Inorganic Chemistry (Q3); Organic Chemistry (Q3); Physical and Theoretical Chemistry (Q3); Catalysis (Q4); Molecular Biology (Q4); Spectroscopy (Q4)"
543;23100;"Proceedings of the Japan Academy Series B: Physical and Biological Sciences";journal;"13492896, 03862208";0,357;Q1;55;36;145;1916;129;145;0,92;53,22;Japan;Asiatic Region;"Japan Academy";"1977-2020";"Multidisciplinary (Q1); Agricultural and Biological Sciences (miscellaneous) (Q2); Medicine (miscellaneous) (Q2); Physics and Astronomy (miscellaneous) (Q3)"
544;23092;"Revista da Sociedade Brasileira de Medicina Tropical";journal;"00378682, 16789849";0,357;Q3;52;138;417;2467;284;399;0,64;17,88;Brazil;Latin America;"Sociedade Brasileira de Medicina Tropical";"1972-1976, 1986-2020";"Infectious Diseases (Q3); Microbiology (medical) (Q3); Parasitology (Q3)"
545;96929;"Maydica";journal;"00256153";0,356;Q3;34;52;135;1863;66;133;0,41;35,83;Italy;Western Europe;"Experimental Institute for Cereal Research";"1993-2020";"Agronomy and Crop Science (Q3); Plant Science (Q3); Genetics (Q4)"
546;11000153760;"Computational and Mathematical Methods in Medicine";journal;"17486718, 1748670X";0,355;Q2;48;17;46;393;37;44;0,48;23,12;United States;Northern America;"Hindawi Publishing Corporation";"2006-2020";"Biochemistry, Genetics and Molecular Biology (miscellaneous) (Q2); Medicine (miscellaneous) (Q2); Applied Mathematics (Q3); Modeling and Simulation (Q3); Immunology and Microbiology (miscellaneous)  (Q4)"
547;21981;"Helminthologia";journal;"04406605, 13369083";0,355;Q3;28;46;111;1153;73;110;0,56;25,07;Poland;Eastern Europe;"De Gruyter Open Ltd.";"1979-1980, 1996-2020";"Animal Science and Zoology (Q3); Parasitology (Q3)"
548;17492;"Neuroendocrinology Letters";journal;"0172780X";0,352;Q2;66;196;364;5167;404;336;1,09;26,36;Sweden;Western Europe;"Maghira and Maas Publications";"1979-1982, 1984-1995, 1997-2019";"Medicine (miscellaneous) (Q2); Endocrinology (Q3); Endocrinology, Diabetes and Metabolism (Q3); Neurology (Q3); Neurology (clinical) (Q3); Psychiatry and Mental Health (Q3); Endocrine and Autonomic Systems (Q4)"
549;26551;"Geological Survey of Denmark and Greenland Bulletin";book series;"16048156";0,351;Q2;29;40;88;832;35;86;0,45;20,80;Denmark;Western Europe;"Miljoeministeriet";"2003-2019";"Geology (Q2)"
550;26627;"Internal Medicine";journal;"13497235, 09182918";0,351;Q2;73;349;920;5254;824;702;0,93;15,05;Japan;Asiatic Region;"Japanese Society of Internal Medicine";"1974, 1992-2020";"Internal Medicine (Q2); Medicine (miscellaneous) (Q2)"
551;13841;"Brazilian Journal of Biology";journal;"15196984, 16784375";0,350;Q2;53;135;274;3703;148;274;0,38;27,43;Brazil;Latin America;"Instituto Internacional de Ecologia";"2000-2020";"Agricultural and Biological Sciences (miscellaneous) (Q2)"
552;19316;"Lindbergia";journal;"01050761";0,350;Q3;18;10;51;423;26;49;0,63;42,30;Netherlands;Western Europe;"Lindbergia";"1979, 1984, 1993-2008, 2010-2020";"Ecology, Evolution, Behavior and Systematics (Q3); Plant Science (Q3)"
553;21100199768;"Practical Assessment, Research and Evaluation";journal;"15317714";0,350;Q2;52;11;58;213;79;58;1,29;19,36;United States;Northern America;"";"1989, 1991, 1993, 1995, 1997, 1999, 2001, 2003-2019";"Education (Q2)"
554;14248;"Sociobiology";journal;"03616525";0,350;Q3;38;127;336;3449;175;336;0,48;27,16;United States;Northern America;"California State University, Chico";"1988, 1993-1994, 1996-2020";"Insect Science (Q3)"
555;16269;"Journal of Legal Studies";journal;"15375366, 00472530";0,348;Q1;61;17;55;810;56;55;1,20;47,65;United States;Northern America;"University of Chicago";"1983, 1985, 1996-2020";"Law (Q1)"
556;130149;"Hereditary Cancer in Clinical Practice";journal;"18974287, 17312302";0,347;Q3;25;33;28;527;26;23;0,93;15,97;United Kingdom;Western Europe;"BioMed Central Ltd.";"2004-2020";"Oncology (Q3); Genetics (clinical) (Q4)"
557;22659;"Acta Chromatographica";journal;"12332356";0,346;Q2;28;39;68;911;76;68;1,26;23,36;Hungary;Eastern Europe;"Akademiai Kiado";"1996-2020";"Chemistry (miscellaneous) (Q2)"
558;22026;"Journal of Ceramic Processing Research";journal;"12299162";0,346;Q2;30;76;173;1126;84;173;0,47;14,82;South Korea;Asiatic Region;"Hanyang University";"2000-2020";"Ceramics and Composites (Q2)"
559;29634;"Journal of Negative Results in BioMedicine";journal;"14775751";0,346;Q1;22;19;23;696;22;23;1,00;36,63;United Kingdom;Western Europe;"BioMed Central Ltd.";"2002-2017";"Pharmacology, Toxicology and Pharmaceutics (miscellaneous) (Q1); Biochemistry, Genetics and Molecular Biology (miscellaneous) (Q2); Medicine (miscellaneous) (Q2)"
560;22596;"Revista de Saude Publica";journal;"00348910, 15188787";0,346;Q2;77;214;419;3454;431;387;0,83;16,14;Brazil;Latin America;"University of Sao Paolo";"1967-2020";"Medicine (miscellaneous) (Q2); Public Health, Environmental and Occupational Health (Q2)"
561;4400151401;"Condensed Matter Physics";journal;"1607324X";0,345;Q3;25;73;69;1892;44;66;0,64;25,92;Ukraine;Eastern Europe;"National Academy of Sciences of Ukraine";"2005-2020";"Condensed Matter Physics (Q3); Physics and Astronomy (miscellaneous) (Q3)"
562;12255;"Journal of Orthopaedic Surgery";journal;"10225536, 23094990";0,345;Q2;40;82;156;45;111;146;0,53;0,55;United States;Northern America;"SAGE Publications Inc.";"1993-2020";"Surgery (Q2)"
563;17000;"Journal of the Japan Petroleum Institute";journal;"13468804, 1349273X";0,345;Q2;27;29;148;510;72;145;0,55;17,59;Japan;Asiatic Region;"Japan Petroleum Institute";"2002-2020";"Energy Engineering and Power Technology (Q2); Fuel Technology (Q2)"
564;25149;"Journal of Toxicological Sciences";journal;"18803989, 03881350";0,345;Q2;50;47;101;1260;114;100;0,99;26,81;Japan;Asiatic Region;"Japanese Society of Toxicological Sciences";"1976-2020";"Medicine (miscellaneous) (Q2); Toxicology (Q3)"
565;22604;"Revista Panamericana de Salud Publica/Pan American Journal of Public Health";journal;"16805348, 10204989";0,345;Q2;57;100;348;2998;332;317;0,93;29,98;United States;Northern America;"Pan American Health Organization";"1997-2020";"Public Health, Environmental and Occupational Health (Q2)"
566;26583;"Ceramics - Silikaty";journal;"08625468, 18045847";0,343;Q2;32;36;98;621;57;98;0,64;17,25;Czech Republic;Eastern Europe;"Institute of Chemical Technology";"1991-2020";"Ceramics and Composites (Q2); Chemical Engineering (miscellaneous) (Q2); Materials Chemistry (Q2); Analytical Chemistry (Q3); Physical and Theoretical Chemistry (Q3)"
567;27926;"Geofisica International";journal;"00167169";0,343;Q1;26;21;162;644;69;161;0,31;30,67;Mexico;Latin America;"Universidad Nacional Autonoma de Mexico";"1975, 1979, 1984-2020";"Energy (miscellaneous) (Q1); Geophysics (Q3)"
568;22636;"Western Criminology Review";journal;"10964886";0,343;Q2;0;0;0;0;0;0;0,00;0,00;United States;Northern America;"Western Society of Criminology";"2002-2014";"Sociology and Political Science (Q2)"
569;23211;"Zoosystema";journal;"16389387, 12809551";0,342;Q3;26;57;63;1614;51;63;0,81;28,32;France;Western Europe;"Museum National d'Histoire Naturelle";"1998-1999, 2002, 2004-2020";"Animal Science and Zoology (Q3); Ecology, Evolution, Behavior and Systematics (Q3)"
570;16865;"Acta Sociologica";journal;"00016993, 15023869";0,341;Q2;52;25;65;1077;43;60;0,40;43,08;United Kingdom;Western Europe;"SAGE Publications Ltd";"1956-1959, 1962, 1964-2020";"Sociology and Political Science (Q2)"
571;15946;"Journal of Korean Medical Science";journal;"15986357, 10118934";0,341;Q2;66;214;558;4954;602;552;0,97;23,15;South Korea;Asiatic Region;"Korean Academy of Medical Science";"1986-2020";"Medicine (miscellaneous) (Q2)"
572;17500154724;"Trabajos de Prehistoria";journal;"19883218, 00825638";0,340;Q1;20;19;61;1242;19;59;0,25;65,37;Spain;Western Europe;"CSIC Consejo Superior de Investigaciones Cientificas";"2003-2020";"Archeology (Q1); Archeology (arts and humanities) (Q1)"
573;21451;"Journal of Interactive Online Learning";journal;"15414914";0,339;Q2;35;21;57;535;30;56;0,53;25,48;United States;Northern America;"National Center for Online Learning Research";"2002-2018";"Education (Q2); E-learning (Q2); Computer Science Applications (Q3); Human-Computer Interaction (Q3)"
574;18327;"Journal of Veterinary Science";journal;"1229845X, 1976555X";0,339;Q2;47;74;173;1559;169;173;1,14;21,07;South Korea;Asiatic Region;"Korean Society of Veterinary Science";"2000-2020";"Veterinary (miscellaneous) (Q2)"
575;19398;"Acta Pharmaceutica";journal;"18469558, 13300075";0,338;Q2;59;40;106;1059;140;104;1,33;26,48;Croatia;Eastern Europe;"Croatian Pharmaceutical Society";"1986, 1992-2021";"Medicine (miscellaneous) (Q2); Pharmaceutical Science (Q2); Pharmacology (Q3)"
576;13715;"Entropy";journal;"10994300";0,338;Q3;74;18;87;343;60;86;0,77;19,06;Switzerland;Western Europe;"MDPI Multidisciplinary Digital Publishing Institute";"1999-2020";"Physics and Astronomy (miscellaneous) (Q3)"
577;89440;"Genomics, Proteomics and Bioinformatics";journal;"16720229";0,338;Q2;49;30;104;879;89;96;0,85;29,30;China;Asiatic Region;"Beijing Genomics Institute";"2003-2020";"Medicine (miscellaneous) (Q2); Computational Mathematics (Q3); Biochemistry (Q4); Genetics (Q4); Molecular Biology (Q4)"
578;15300154856;"Journal of Geosciences (Czech Republic)";journal;"18026222, 18031943";0,337;Q2;30;13;126;673;48;123;0,29;51,77;Czech Republic;Eastern Europe;"Czech Geological Survey";"2007-2020";"Earth and Planetary Sciences (miscellaneous) (Q2); Geology (Q2)"
579;200147134;"First Monday";journal;"13960466";0,336;Q1;70;173;329;4237;255;322;0,62;24,49;United States;Northern America;"First Monday";"1996-2019";"Law (Q1); Computer Networks and Communications (Q2); Human-Computer Interaction (Q3)"
580;39600;"Milchwissenschaft";journal;"00263788";0,336;Q2;39;90;337;1703;175;337;0,53;18,92;Germany;Western Europe;"AVA-Verlag Allgau";"1973-1989, 1996-2012";"Food Science (Q2)"
581;16304;"Adsorption Science and Technology";journal;"02636174";0,335;Q2;36;71;210;1972;158;210;0,71;27,77;United Kingdom;Western Europe;"SAGE Publications Inc.";"1984-1985, 1989-2020";"Chemical Engineering (miscellaneous) (Q2); Chemistry (miscellaneous) (Q2); Surfaces and Interfaces (Q3)"
582;25182;"Applied Mathematics E - Notes";journal;"16072510";0,335;Q3;19;36;83;398;29;83;0,41;11,06;Taiwan;Asiatic Region;"Tsing Hua University";"2001-2020";"Applied Mathematics (Q3)"
583;18006;"Archivos de Bronconeumologia";journal;"15792129, 03002896";0,335;Q2;49;151;493;4118;543;351;1,28;27,27;Spain;Western Europe;"Ediciones Doyma, S.L.";"1970, 1981, 1983-2020";"Pulmonary and Respiratory Medicine (Q2)"
584;27927;"Geofizika";journal;"03523659";0,334;Q3;16;11;18;240;12;17;0,42;21,82;Croatia;Eastern Europe;"Geofizicki Zavod";"1989-1992, 1996-1999, 2001, 2003-2020";"Geophysics (Q3)"
585;21100855842;"Journal of Earth System Science";journal;"23474327, 02534126, 0973774X";0,334;Q2;52;53;178;2072;108;173;0,60;39,09;India;Asiatic Region;"Indian Academy of Sciences";"2005-2020";"Earth and Planetary Sciences (miscellaneous) (Q2)"
586;15440;"Dialogues in Clinical Neuroscience";journal;"19585969, 12948322";0,333;Q3;87;49;114;3577;80;100;0,93;73,00;France;Western Europe;"Servier International";"2002-2020";"Biological Psychiatry (Q3); Psychiatry and Mental Health (Q3)"
587;15664;"Functional Neurology";journal;"19713274, 03935264";0,332;Q2;42;32;99;820;92;84;0,72;25,63;Italy;Western Europe;"CIC Edizioni Internazionali s.r.l.";"1986-2019";"Medicine (miscellaneous) (Q2); Neurology (clinical) (Q3); Neuroscience (miscellaneous) (Q3)"
588;18895;"Journal of Advanced Transportation";journal;"01976729, 20423195";0,332;Q2;46;17;49;304;29;49;0,79;17,88;Egypt;Africa/Middle East;"Hindawi Limited";"1979-2020";"Automotive Engineering (Q2); Mechanical Engineering (Q2); Computer Science Applications (Q3); Economics and Econometrics (Q3); Strategy and Management (Q3)"
589;5600152714;"Scientific Online Letters on the Atmosphere";journal;"13496476";0,329;Q3;32;45;2;659;1;2;0,50;14,64;Japan;Asiatic Region;"Meteorological Society of Japan";"2005-2020";"Atmospheric Science (Q3)"
590;29837;"Sensors and Materials";journal;"09144935";0,329;Q2;28;39;128;620;95;122;0,81;15,90;Japan;Asiatic Region;"M Y U Scientific Publishing Division";"1996-2020";"Materials Science (miscellaneous) (Q2); Instrumentation (Q3)"
591;21337;"Health Research Policy and Systems";journal;"14784505";0,328;Q2;49;25;18;859;36;18;1,44;34,36;United Kingdom;Western Europe;"BioMed Central Ltd.";"2003-2020";"Health Policy (Q2); Medicine (miscellaneous) (Q2)"
592;20997;"Canadian Journal of Surgery";journal;"0008428X, 14882310";0,327;Q2;64;90;332;1253;247;274;0,61;13,92;Canada;Northern America;"Canadian Medical Association";"1957-2020";"Medicine (miscellaneous) (Q2); Surgery (Q2)"
593;29277;"Cleveland Clinic Journal of Medicine";journal;"08911150";0,326;Q2;63;177;442;3830;411;347;1,03;21,64;United States;Northern America;"Cleveland Clinic Educational Foundation";"1987-2020";"Medicine (miscellaneous) (Q2)"
594;21100375849;"Open Physics";journal;"23915471";0,326;Q3;38;42;91;1051;77;90;0,85;25,02;Germany;Western Europe;"Walter de Gruyter GmbH";"2015-2020";"Physics and Astronomy (miscellaneous) (Q3)"
595;19494;"Veterinarni Medicina";journal;"18059392, 03758427";0,326;Q3;50;64;195;2285;165;189;0,74;35,70;Czech Republic;Eastern Europe;"Czech Academy of Agricultural Sciences";"1971-2020";"Veterinary (miscellaneous) (Q3)"
596;19700201301;"Chiropractic and Manual Therapies";journal;"2045709X";0,325;Q1;32;27;25;900;31;24;1,24;33,33;United Kingdom;Western Europe;"BioMed Central Ltd.";"2011-2020";"Chiropractics (Q1); Complementary and Alternative Medicine (Q2); Physical Therapy, Sports Therapy and Rehabilitation (Q2)"
597;15072;"Journal of Information Technology in Construction";journal;"14006529, 14036835";0,325;Q2;45;51;57;1172;68;53;0,93;22,98;Sweden;Western Europe;"Kungliga Tenkniska Hoegskolan/Royal Institute of technology";"1995-2020";"Building and Construction (Q2); Civil and Structural Engineering (Q2); Computer Science Applications (Q3)"
598;24119;"African Zoology";journal;"15627020";0,323;Q3;28;41;119;1134;64;119;0,41;27,66;United Kingdom;Western Europe;"Taylor and Francis Ltd.";"1996-2020";"Animal Science and Zoology (Q3)"
599;20500;"Bulletin of Materials Science";journal;"02504707, 09737669";0,323;Q2;72;115;327;2313;229;325;0,55;20,11;India;Asiatic Region;"Indian Academy of Sciences";"1979-2020";"Materials Science (miscellaneous) (Q2); Mechanics of Materials (Q2)"
600;13831;"Chinese Journal of Aeronautics";journal;"10009361";0,322;Q2;50;107;145;1214;54;145;0,41;11,35;China;Asiatic Region;"Chinese Journal of Aeronautics";"1990-1991, 1996-2020";"Aerospace Engineering (Q2); Mechanical Engineering (Q2)"
601;28360;"Journal of Object Technology";journal;"16601769";0,322;Q3;37;81;270;981;268;253;0,85;12,11;Switzerland;Western Europe;"";"2002-2020";"Software (Q3)"
602;37958;"Geographical Review";journal;"00167428, 19310846";0,321;Q2;44;34;81;1721;38;76;0,34;50,62;United States;Northern America;"Wiley-Blackwell";"1969, 1973, 1976, 1979-2020";"Earth-Surface Processes (Q2); Geography, Planning and Development (Q2)"
603;145505;"Revista Brasileira de Ciencia do Solo";journal;"01000683";0,321;Q3;51;106;212;3222;92;212;0,43;30,40;Brazil;Latin America;"Revista Brasileira de Ciencia do Solo";"2004-2020";"Agronomy and Crop Science (Q3); Soil Science (Q3)"
604;23471;"Croatica Chemica Acta";journal;"1334417X, 00111643";0,320;Q3;50;80;222;2367;224;217;0,88;29,59;Croatia;Eastern Europe;"Croatian Chemical Society";"1980-1981, 1996-2020";"Chemistry (miscellaneous) (Q3)"
605;24373;"Dermatology Online Journal";journal;"10872108";0,318;Q2;42;170;338;2173;272;327;0,62;12,78;United States;Northern America;"Department of Dermatology UC Davis";"1996-2020";"Dermatology (Q2); Medicine (miscellaneous) (Q2)"
606;98776;"Journal of Applied Botany and Food Quality";journal;"16139216";0,318;Q3;37;28;99;901;68;99;0,58;32,18;Germany;Western Europe;"Druckerei und Verlag Liddy Halm";"2004-2020";"Food Science (Q3); Plant Science (Q3)"
607;24663;"Revista de la Asociacion Geologica Argentina";journal;"00044822";0,317;Q2;39;51;202;2747;73;201;0,29;53,86;Argentina;Latin America;"Asociacion Geologica Argentina";"1992-1994, 1996-2020";"Geology (Q2)"
608;4400151728;"Revista Mexicana de Ciencias Geologicas";journal;"10268774";0,317;Q2;35;30;90;1439;66;89;0,75;47,97;Mexico;Latin America;"Universidad Nacional Autonoma de Mexico";"1996-2020";"Geology (Q2)"
609;27404;"Brazilian Journal of Physics";journal;"01039733";0,316;Q3;48;295;693;6021;376;685;0,54;20,41;United States;Northern America;"Springer New York";"1996-2020";"Physics and Astronomy (miscellaneous) (Q3)"
610;14786;"Nutricion Hospitalaria";journal;"16995198, 02121611";0,315;Q2;53;119;192;3659;220;175;1,08;30,75;Spain;Western Europe;"ARAN Ediciones S.A.";"1989-2020";"Medicine (miscellaneous) (Q2); Nutrition and Dietetics (Q3)"
611;79372;"Bulletin of the Brazilian Mathematical Society";journal;"16787714, 16787544";0,314;Q3;30;31;73;579;26;72;0,33;18,68;United States;Northern America;"Springer New York";"1996, 1998, 2000, 2002-2020";"Mathematics (miscellaneous) (Q3)"
612;24110;"Indian Journal of Chemistry - Section A Inorganic, Physical, Theoretical and Analytical Chemistry";journal;"09750975, 03764710";0,314;Q3;40;168;734;4456;451;730;0,63;26,52;India;Asiatic Region;"Scientific Publishers of India";"1996-2018";"Inorganic Chemistry (Q3); Physical and Theoretical Chemistry (Q3)"
613;19900192160;"Epidemiology and Psychiatric Sciences";journal;"20457979, 20457960";0,311;Q3;48;46;116;1685;92;73;0,85;36,63;United Kingdom;Western Europe;"Cambridge University Press";"2011-2020";"Psychiatry and Mental Health (Q3); Public Health, Environmental and Occupational Health (Q3); Epidemiology (Q4)"
614;35693;"Science of Sintering";journal;"0350820X";0,311;Q2;25;31;58;530;25;58;0,33;17,10;Serbia;Eastern Europe;"International Institute for the Science of Sintering (IISS)";"1974-1976, 1978-1989, 2002-2020";"Ceramics and Composites (Q2); Metals and Alloys (Q2); Condensed Matter Physics (Q3); Materials Chemistry (Q3)"
615;18659;"Anais da Academia Brasileira de Ciencias";journal;"00013765, 16782690";0,310;Q1;58;65;176;2787;183;176;0,89;42,88;Brazil;Latin America;"Academia Brasileira de Ciencias";"1945-1946, 1949, 1970-1992, 1994-2020";"Multidisciplinary (Q1)"
616;21100241807;"Artificial Cells, Nanomedicine and Biotechnology";journal;"2169141X, 21691401";0,310;Q2;46;43;124;1131;123;122;1,01;26,30;United States;Northern America;"Informa Healthcare";"2013-2020";"Medicine (miscellaneous) (Q2); Pharmaceutical Science (Q2); Biomedical Engineering (Q3); Biotechnology (Q3)"
617;21082;"Pharmaceutical Biology";journal;"13880209, 17445116";0,310;Q2;64;118;388;2997;234;385;0,47;25,40;United Kingdom;Western Europe;"Taylor and Francis Ltd.";"1961-1972, 1975-2020";"Complementary and Alternative Medicine (Q2); Medicine (miscellaneous) (Q2); Pharmaceutical Science (Q2); Drug Discovery (Q3); Pharmacology (Q3); Molecular Medicine (Q4)"
618;144680;"Reproductive Health";journal;"17424755";0,310;Q2;52;10;18;258;25;17;1,39;25,80;United Kingdom;Western Europe;"BioMed Central Ltd.";"2004-2020";"Obstetrics and Gynecology (Q2); Reproductive Medicine (Q3)"
